,Place,Column No.,Paragraph
31,"['Marano', 'FrìuliX']",546,"Se intese, in Colegio, per lelere dil cavalier di la  Volpe, date in Udene a di . . . scrite al suo canze-  lier, come il conte Cristoforo Frangipani era zonto  al governo di Maran. "
32,"['Marano', 'FrìuliX']",550,"Il Papa disse: e Non, che tutto sia a nui». Por TO-  rator li dimandò quello havia di Spagna. Disse : < Si  dice per spagnoli in Spagna esser gran garbugii, et li  popoli sono in acordo con li grandi, siche bisogna il  Re vadi in Spagna ; e si tien monsignor di Chievers  non vi anderà, dubitando esser morto e deponulo  dal governo». Scrive, li foraussili nostri é li a Ro-  ma, hanno levato la Signoria nostra ha richiesto per  via dil nostro ambasator è in corte di la Cesarea Ma-  està acordo con quella ; il qual ha risposto che di le  cose aspela al duchalo di Austria lo farà, ma di quello  aspeta a V Imperio non voi senza voluntà de li Kle-  clori, siche a questa dieta si tratarà; e dicono che lui  Orator ha parlalo al Papa di questo, esorli esso Re  a concluder dito acordo, et uno Antonio Bagaroto  va monstrando certa teiera di Alemagna, come il  conte Cristoforo vien al governo di Gorizia, Gradi-  scila e Marano, e li dà la Cesarea Maestà ducati 48  oiilia a Tanno, e li ha dà le possession di nostri sub-  diti ; el qual ha promesso farli aquistar eie. Scrive, il  Papa ha dato lo episcopà di Pampalona, fo dil car-  dinal Libret morto, al reverendissimo Cesarino, con  pension di ducali 2500 al reverendissimo CoIona.  Non si sa se la Cesarea Maestà vorà asenlir; pur  hessendo Colonesi di soi, per questo forsi asenlirà.  Scrive, é stato da monsignor di Pin orator di Pran-  za, é l], per alegrarsi dil vescoado auto, qual vai du-  cali 4000 a Tanno. Era in letto con gotte, ringratia  molto la Signoria, con molle parole hinc inde dicUe  ut in litteris. "
33,"['Marano', 'FrìuliX']",554,"Di Cividal di Friul, di domino Hironimo  di Nordio dotor^ citodin de lì, di 12, drieata a  sier Antonio Grimani procuratore Scrive come,  per la venuta dil conte Cristoforo al governo di Go-  ricia e di Gradiscba e Maran, quella terra di Civi-  dal bisogna esser custodita; qual si fosse robata, sa-  ria perso la Patria, però si provedi. Et é sviso, il dito conte Crìsloforo esser zonto a Posloyiia, e come io Cìvidal é pocba zeote per la peste vi é stala. 833* Fo leto una suplication di Fnnceseo Bod qu. sier Zorzi cretese, domanda di gratia sia fato nobile cretese acciò possi partecipar di quelli ofBcii, et questo per esser fiol naturai etc, e li sia concesso a lui esto per esser fiol naturai etc, e li sia concesso a lui e so' Goti ; et leto la risposta dii rezimento di Crete che conseja se li poi Tar tal gratia, ut in ea."
34,"['Marano', 'FrìuliX']",556,"Dì Franga, di V Oraior nostro, date « jBbs,  a dì 3. Come, havendo auto letere di 17 Dieembm,  di rOrator nostro apresso la Cesarea Maestà aercfaa  il mandar dil conte Crìstoforo al governo di Gradi-  scha, Maran etc, e per esser di la qualità li aaria  bon non fusse mandato aedo non fusse principio di  guerra ; et perché il Re era con la Raioa e madre  e pochi de li soi a uno vilazo mia 15 loolan, loeo da  non poter habitar altri, mandò il suo Secretano a  pn^r quella Maestà voy scriver in Alemagoa che  sia revochato tal electione. Et lui Orator parlò a DM»-  signor l' Armirajo, era li a Bies, qual disse si brk  scriver al suo Orator parli a la Cesarea Maestà doq  lo mandi, saria prìncipio di novità, ei che firaueesi é  desiderosi di guerra per esser sta sema soldo qual-  che tempo. Poi disse esser venuto quel GharoD ora-  tor dì Anglia con li presenti a quel Re, e voler  in optima benivolentia con la Cfaristianissima Ml..^,  e di le cose di Scozia vorìa li oratori seozesi andas-  seno a quel Re; siche si vederà di conzar qudle eoae,  perché sono in dojudici, la illustrissima Madama  per il Re nostro e il reverendissimo cardinal Ebo-  raoense per il Re di Anglia; per il che si manda  monsignor Polit in Anglia a questo eSaeio e fìicsi  passerà fino in Scozia. Poi parlando di Roma, disse  non esser altro. Monsignor di San Marzeo Iratavm  alcune cosse di pocho momento; non é sta expedito  ancora. Scrive, il Re con la corte va a RemoraDtiuo  dove starà alcuni zorni, |k>ì si transierirà a Lioo.  Scrive, ditto orator anglico dimandò si 'I Re andava a IJon Ad abocharsi col Papa. Li fo risposto è assa' tempo non è sii al suo slato de Milan e li bisognava andar a rivederlo, e andando, forsi si abocheri col Papa a Bologna. Tamen ancora non havia concluso; 334* Ola zonto a Lion terminerà quello li parerà. Scrive, il Secrelario parlò al Re dìl conte Cristoforo, qual li disse scriverà al suo ambasator, ut supra. Eiiam parlò a Madama e li disse ut supra. Si scusa diclo Orator nostro, si cussi spesso non aviserà Ano non sii a Liou, et manda letere di TOralor nostro in Anglia."
35,"['Marano', 'FrìuliX']",557,"DiAngUa^ dil Surian orntor nostro^ date a  Londra a dì 28 Navembrio. Come ricevete no-  stre letere con li sumari dil zonzer di Torator dil  Turco per ooorinnar la paxe, e la eletion fata di  l' oralor Uinio al dito Signor, et la letera drizata al  reverendissimo Cardenal, ringraliatoria dil bon oRcio  fato per la Signoria nostra. Unde andò dal prefato  Gardena!, e li comunicò dite nove. Disse, questo Si-  gnor ha anni :25, è di bona prudenlia, saria da temer  non fosse come il padre; poi 11 de la letera di la Si-  gnoria con parole acomodate. Quella lela, ringratiò  la Signoria offerendosi etc. Poi disse, aver il Papa  voi sguizari per la impresa di Ferara, et che il re di  Pranza, ni la Signoria nostra doveva soportar, ni  etiam el suo Re li piace per esser di nominati per  dita Maestà in la Itga et paxe con Pranza fala ; et che  l'ha scrito al Papa, con altre parole indicative la  mala contenteza di questo. Poi li disse, tien il re Cri-  stianissimo non vera in Italia, et che la Cesarea Ma-  jesià, fato le visite con il serenissimo re di Hongaria  el Polonia et lo illustrissimo Infante suo fradelo nel  qoal é mandata madama Anna sorela dil re di Hon-  garia, le qual viste sarano a meza Quaresema, an-  derà in Spagna per cessar quelli tumulti, e lasserà  vicario imperiai dito Infante, perché cussi é con-  tento il ducha di Saxooia al qual pareva convenisse  questo cargo. Poi disse, che *l conte Cristoforo ve-  niva in Friul al governo di quelli lochi mandato a  requisition dil cardenal Curzense ch'é suo cugnato,  zoé di Maran et Gradischa, che sono di la Signoria  nostra. "
36,"['Marano', 'FrìuliX']",584,"Di Udene, di sier Francesco Donado ti ca-  valier, luogotenente in la Patria, di 21. Come,  in execution di le teiere di la Signoria nostra, disse  al magniRco capitano cavalier di la Volpe, andasse  a stanziar in Cividal. Il qual rispose adderi oiolto  volentieri, et ha mandato a preparar le fttansie ; ma  voria le chiave di le porte in le man, qual lieo quel-  la comunità, /fem, ha dito a Cesare sao fradelo,  fazi venir in Udene alozar li 18 homeot d*»rme, et  (Hissl fari. Scrive di capi di siratioti a far ei aimilc.  Item, et cavalier di la Volpe li In dito li cavali in  Cividal noh fìi miHa, meglio saria Canti fonti. EI ba  mandalo uno suo a Postoyna loco dfl odate Cristo-  fbro per saper la sua venuta; el qual conte Cristoforo  non é ancora zonto, et se divulga verik eoa 100 ca-  vali todeschi, licei votìa lui menar corrati, ma to-  deschi non voleno eorvali, et lui li meacri e non  sarà altro. Scrive, in Maran, Gradischa et Gorida,  poleno esser da 1 SO in 200 l^nii, a lercha 30 ca*  vali di todescbi. "
37,"['Marghera', 'Margera']",111,"Fo poi posto, per sier Antonio Condolmer, sier  Gasparo Malipiero, sier Marin Morexini provedadori  sora le aque, una parte de avrir il cavo di Margen,  con li modi ut in parte. Andò in renga sier Moisé  Venier, dicendo è materia di gran consideration et  impoctantia, et era t)on dar tempo che si pensase etc.  "
38,"['Marghera', 'Margera']",112,"Fo poi posto, per sier Antonio Condolmer, sier Gasparo Malipiero, sier Marin Morexini provedadori sora le aque, una parte de avrir il cavo di Margen, con li modi ut in parte. Andò in renga sier Moisé Venier, dicendo è materia di gran consideration et impoctantia, et era t)on dar tempo che si pensase etc.   Pariò sier Gasparo Malipiero narando la cossa, fa-  cendo lezer molte deposition etc. El volendo man*  dar la parte, sier Marco Antonio lioredan, qual è  slato sora le aque e fé' lui far il cavo a Margera,  andò in renga, contradicendo tal opinion, e si dove-  ria far deaegni e veder ben la cossa, el non corer a  furia, e far uno Golegio di 30 come fa fato altre  fiale. Et venuto zoso, discordo fu terminato indusiar  questa materia per esser di summa importantia. "
39,"['Marghera', 'Margera']",163,"Poi fo dato, per li Provedadori som le aque,  sier Antonio Condolmer, sier Gasparo Malipiero,  sier Mann Morexiiii, un dis^o per uno di quelli  erano ip Pregadi, fato a stampa, ne hanno fato far  950, li costa ducali 11, aziò tutti vedano dove vote-  no mandar le acque dolze per una allra via, e rom-  per il cavo di Margera, e si possi andar con barcba  fino a Mestre. "
40,"['Marghera', 'Margera']",163,"Poi parto sier Mario Morcxini benissiipo, eoa  gran voie et li dele gran bole, et che 1 parla\*a  perchè sier Lorenzo Minio fradelo di so' zen^ro  havia ana hostaria a Margera, et fé' lezer una ler  tera che '1 ditto scrive a sier Jacomo di la f da  Mestre di questa materia, viddieet esso sier Lo-  reozo Minio, che lenisse modo non si levasse il cavo,  saria danno di T hostaria di Margera. Poi parlò su  la materia, dicendo le rason e V optimo (hitto se-  guirà ; di che si portò benissioH); Andò la parte: 17 di i|o, 1^^ di si, et lu 17 non sincere, la copia di In qual detiberitioD poterò qui avanti.terò qui avanti."
41,"['Marghera', 'Margera']",169,reteriM anni serate le aque dolce a Margera et fato 
42,"['Marghera', 'Margera']",169,li di terreo! si lezieri da Margera a Liza Fusina che 
43,"['Marghera', 'Margera']",169,"nec non al ponte di Margera. Et perché, facto dicto "
44,"['Marghera', 'Margera']",169,Botenigo el cavamento de Margera e Liza Fusina re- 
45,"['Marghera', 'Margera']",170,"vadino suso quanto pili le pono, et habiNo più corso a le Ucune nostre, et siano causa de extirpar tutte le  canne nassule si nel dicto alveo novo come in ditti 113*  canali, cbe sarà total beneficio non solum di le La-  cune nostre predite, ma etiam purificazion de Taere  di questa nostra cita. Nec non sia cavala la fossa  chiamata la Gradenica, la qual é apresso la strata re-  cto tramite fino al canal di san Lorenzo di Mestre.  Et da mo' sia preso : che in primis et ante om-  nia principiar si debia el ditto cavamento novo di  le pertege 301 1 cum li arzeri potenti da resister da  quella banda a le aque dolze che penetrar non pos-  sino in la lacuna nostra, et similiter che da quella  banda fortificar et reparar se debia li arzeri de la  Brenta per il medemo effeclo, et similiter la De-  steoa cbe va a la via del Dexe, come di sopra e dicto.  Quo facto^ remover se debia el Caro et Tarzere dove  é fuiKlato esso Caro de Margera per aprir la via a le  aque salse, et non pi*ima per alcun modo : decbia-  rando che tutte le terre che al presente non sono  lavorale non se possino redur a cultura, ma riman-  gino tutte a pradi, dovendose però obturar et stro-  par tutte le gore et sboradori cbe cadauna di dito  terre lavorate bavesseno, le qual butasseno in alcun  de li canali preditti, cussi da la banda del Botenigo  verso Mestre, come da li arzeri de la Brenta fino al  Botenigo, da la dita cava in zoso verso le acque  salse, aziò iK)n sia dannificata la Laguna nostra, sotto  irreniissibel pena de perder le terre, le qual ipso  facto se intendino esser confiscato in la Signoria  nostra, un terzo de le qual sìa de li acusador e li  doi terzi de V oiieio nostro sopra le Aque, da esser  convertilo el tracio de quelle a beneficio di la La-  cuna nostra. Et siano tonuti li Savii nostri sora le  aque presenti e futuri circha diete |)ene a exequir la  presento deliberation, sotto debito de sacramento et  pena di ducati 500. "
46,"['Marghera', 'Margera']",266,"Poi sier Marin Moresini savio sora le aque andò 169  in renga, et fece un gran discorso zercha la impor-  tanlia di le aque, narando la execution di la parie  come havevano aClado zoé dado a far le do cave a  Margera fino a Mestre che oosla^-ano (ulte do zerca  ducati 10 milia, dicendo bisogna danari, et ne ha-  veaoo trova dil vender di trageti uua quantità, e di  altre cosse, et voleano inlrar in quelli hanno aterrà  e fatto possession a li lidi con il sabion di la Signo-  ria, et vdeoo far andar la Brenta per Talveo nuovo  eome fo deliberato, ma voleano denari, senza i qual  non poleno far nulla. Però veleno meter alcune  parte, videlieet di vender oflidi si fa per li signori,  sospender le expectatìve fate, far Vita hebreo possi  venir in questa (erra e voi donar ducati 3ó0, e altro,  e meter quella parte dil rambiar di bandi, justifi-  candose le parte messene li altri Pregadi esser jusle,  et lieet per missier Inerenze Bragadin avogador era  sia impedito, havìa aulorì(à Toficio. El fé' lezer la  creazion dil 1501 nel Conscjo di X, di tre Savii sora  le aque, quali venisseno nel Consejo di X. Jtem^ dil  1505 come fu data autorità di meter parie con un  Coisier et Cao di X. Jfem, dil 1515, poi irata la  materia di le aque e falò uno Colcigio di 15, quali nel  Colegio di la Signoria trali tal materia ; fé* lezer la  parte, non si poi asolver uno se oon per via di gra-  tis ; fo molto loogo, sté più di do bore io renga, et  venuto zoso : "
47,['Mestre'],35,"Queste è per grafia.     Castelan a la Sarasinesctia di Padoa, fraddi qu. sier  Zuan Malipiero mori a Hodon.  Castelan a Mestre, foli di sier Alvise Micfaiel mori a "
48,['Mestre'],120,"A dì 21 dito. Vene in Colegio sier Valerio Mar-  zello savio a Terra ferma, tomaio di le monstre fate  a Cotogna et Montechiarì, parti di qui a di primo di  questo e fato a tutte le zente d'arme, mancha il Co-  vernador qual dice voleva far a Mestre questo Sep- "
49,['Mestre'],163,"Poi fo dato, per li Provedadori som le aque,  sier Antonio Condolmer, sier Gasparo Malipiero,  sier Mann Morexiiii, un dis^o per uno di quelli  erano ip Pregadi, fato a stampa, ne hanno fato far  950, li costa ducali 11, aziò tutti vedano dove vote-  no mandar le acque dolze per una allra via, e rom-  per il cavo di Margera, e si possi andar con barcba  fino a Mestre. "
50,['Mestre'],163,"Poi parto sier Mario Morcxini benissiipo, eoa  gran voie et li dele gran bole, et che 1 parla\*a  perchè sier Lorenzo Minio fradelo di so' zen^ro  havia ana hostaria a Margera, et fé' lezer una ler  tera che '1 ditto scrive a sier Jacomo di la f da  Mestre di questa materia, viddieet esso sier Lo-  reozo Minio, che lenisse modo non si levasse il cavo,  saria danno di T hostaria di Margera. Poi parlò su  la materia, dicendo le rason e V optimo (hitto se-  guirà ; di che si portò benissioH); Andò la parte: 17 di i|o, 1^^ di si, et lu 17 non sincere, la copia di In qual detiberitioD poterò qui avanti.terò qui avanti."
51,['Mestre'],169,"^3i Mestre, che è cavamento di pertege 201 i da quella "
52,['Mestre'],169,per el dito alveo di Mestre; el aciò quella possi me- 
53,['Mestre'],169,omU la Desfeoa che è de là da Mestre per condur 
54,['Mestre'],170,"vadino suso quanto pili le pono, et habiNo più corso a le Ucune nostre, et siano causa de extirpar tutte le  canne nassule si nel dicto alveo novo come in ditti 113*  canali, cbe sarà total beneficio non solum di le La-  cune nostre predite, ma etiam purificazion de Taere  di questa nostra cita. Nec non sia cavala la fossa  chiamata la Gradenica, la qual é apresso la strata re-  cto tramite fino al canal di san Lorenzo di Mestre.  Et da mo' sia preso : che in primis et ante om-  nia principiar si debia el ditto cavamento novo di  le pertege 301 1 cum li arzeri potenti da resister da  quella banda a le aque dolze che penetrar non pos-  sino in la lacuna nostra, et similiter che da quella  banda fortificar et reparar se debia li arzeri de la  Brenta per il medemo effeclo, et similiter la De-  steoa cbe va a la via del Dexe, come di sopra e dicto.  Quo facto^ remover se debia el Caro et Tarzere dove  é fuiKlato esso Caro de Margera per aprir la via a le  aque salse, et non pi*ima per alcun modo : decbia-  rando che tutte le terre che al presente non sono  lavorale non se possino redur a cultura, ma riman-  gino tutte a pradi, dovendose però obturar et stro-  par tutte le gore et sboradori cbe cadauna di dito  terre lavorate bavesseno, le qual butasseno in alcun  de li canali preditti, cussi da la banda del Botenigo  verso Mestre, come da li arzeri de la Brenta fino al  Botenigo, da la dita cava in zoso verso le acque  salse, aziò iK)n sia dannificata la Laguna nostra, sotto  irreniissibel pena de perder le terre, le qual ipso  facto se intendino esser confiscato in la Signoria  nostra, un terzo de le qual sìa de li acusador e li  doi terzi de V oiieio nostro sopra le Aque, da esser  convertilo el tracio de quelle a beneficio di la La-  cuna nostra. Et siano tonuti li Savii nostri sora le  aque presenti e futuri circha diete |)ene a exequir la  presento deliberation, sotto debito de sacramento et  pena di ducati 500. "
55,['Mestre'],187,"Fu posto, per li ditti, atento li casamenti di foli  sopra Mestre non recase per la diversion di le  acque e li moKni di la Signoria nostra in Mestre, e a  r invernata inondar la via dil Teragio, per tanto sia  preso di vender li ditti foli al publico incanto, facen-  do br prima le proclame : 164, 24. "
56,['Mestre'],266,"Poi sier Marin Moresini savio sora le aque andò 169  in renga, et fece un gran discorso zercha la impor-  tanlia di le aque, narando la execution di la parie  come havevano aClado zoé dado a far le do cave a  Margera fino a Mestre che oosla^-ano (ulte do zerca  ducati 10 milia, dicendo bisogna danari, et ne ha-  veaoo trova dil vender di trageti uua quantità, e di  altre cosse, et voleano inlrar in quelli hanno aterrà  e fatto possession a li lidi con il sabion di la Signo-  ria, et vdeoo far andar la Brenta per Talveo nuovo  eome fo deliberato, ma voleano denari, senza i qual  non poleno far nulla. Però veleno meter alcune  parte, videlieet di vender oflidi si fa per li signori,  sospender le expectatìve fate, far Vita hebreo possi  venir in questa (erra e voi donar ducati 3ó0, e altro,  e meter quella parte dil rambiar di bandi, justifi-  candose le parte messene li altri Pregadi esser jusle,  et lieet per missier Inerenze Bragadin avogador era  sia impedito, havìa aulorì(à Toficio. El fé' lezer la  creazion dil 1501 nel Conscjo di X, di tre Savii sora  le aque, quali venisseno nel Consejo di X. Jtem^ dil  1505 come fu data autorità di meter parie con un  Coisier et Cao di X. Jfem, dil 1515, poi irata la  materia di le aque e falò uno Colcigio di 15, quali nel  Colegio di la Signoria trali tal materia ; fé* lezer la  parte, non si poi asolver uno se oon per via di gra-  tis ; fo molto loogo, sté più di do bore io renga, et  venuto zoso : "
57,['Mirano'],169,"I fiume vien da Mirao el la Brentella nel Botenigo, "
58,['Murano'],546,"In questo zorno, el signor principe di Salerno  (Bisognano) andò famigliarmente vedendo la Mar-  zaria, qual fu ben conzada. É stalo a TArsenal, ha  visto a far veri a Muran, e sta su questi piazeri. "
59,"['Oriago', 'Uriago']",66,"Fo scrilo a li reclori di Brexa, dil loco di Caneto  qual il marchese di Mantoa pretende sia suo, et loro  voi esser sodo la Signoria nostra; poróse informino  di la juridition e avisi. "
60,"['Oriago', 'Uriago']",66,"Noto. A di 33, a requisilion di Torator dil Chri-  stianissimo re, qual solicila la cosa di villani di Uria-  go, e per Colegio li fo fato una patente che dove se  ritrovi ditti villani facinorosi di Urìago che amazò  quelli signori francesi li debano far retenir eie. El  nota, fo assa' parole in Colegio per li villani erano  sta lassali di Cabioni, dicendo non si dovea lassar  senza suo voler. "
61,"['Oriago', 'Uriago']",66,"incolpa da una femena. Item, feno salvo conduto  ad uno citadin di Crema, chiamalo .... Benzon,  al qual in questa guerra sier Bortolamio Contarini  relor e provedador di Crema, aleuto li soi meriti  verso la Signoria nostra, li fece salvo conduto, et  per li Avogadori di comun sier Marco Loredan e  sier Hafio Lion, a requisilion di la parte adversa, fo  intromesso el menato in Quaranlia novissima e po-  ehi zomi fa taji di una batota, perché el ditto rector  non bavia auclorilà di fargelo. Hora mo' il Consejo  di X li parse di far dillo salvo conduto al prefato  per anni 101; siche dil delieto fece é sta assolto. "
62,"['Oriago', 'Uriago']",199,"Da poi disnar, fo Conseijo di X per expedir li  presonieri vilani di Uriago. Fo con la Zonta, et non  vi fu il Doxe. "
63,"['Oriago', 'Uriago']",259,"IH Fransa, di sier Zuan Badoer dotor el cavaiier, orator nostro, date a Boesi, a dì 17 Seiembrio. Come, a di 13 scrisse, et avendo ricevuto nostre di 36 con la lelera drizata a quella Ma-vuto nostre di 36 con la lelera drizata a quella Malesia zercha Taceptar il comparadego, el alegrarsilesia zercha Taceptar il comparadego, el alegrarsi con Soa Maestà, eri fo da quella, et li apresenlò dita lelera; qual k prese, et volse il Secretario di r Orator b lezeae: mooslrò ha ver gran piacer. Poi Soa Maestà li disse, il cardinal Sedunense sguizaro esser zonlo a la Calliolìca Maesla, dal quale fu ace* tato honoralamente, et ptMice ha aulo audienlia, fece una oralion, offerendoli ogni favor et 10 milia sguizari al suo comando, dolendosi di esso re Cristianisssimo, qual li havia b\Xo spender 100 miliastianisssimo, qual li havia b\Xo spender 100 milia scudi, et che T era homo ingrato e pericoloso. E poi il Re disse, che li piace habi usalo tal parole, perché quando continuerà in dir mal de lui non li saràché quando continuerà in dir mal de lui non li sarà crelo, dicendo. Iodico per averii fato spender li 100 miUa scudi ; el queste parole ultime le disse in una audienlia secreta. Poi la Cristianissima Maestà predilla , disse che ui Spagna continuava i moti, chedilla , disse che ui Spagna continuava i moti, che era vero di Medina dil Campo stala brusala, et che Fooaecha, che era per nome dil re Calholico rimasto, era fuzito in Portogalo, el il cardinal Dortonense era sta retanuto e licentiala la soa fam^lia , zoé tenuto con guardia, et che la Regina madre di esso re Calholico era sta mooslrata in pergole, et havia 165 parlalo a li populì, dicendoli non haver saputo la morte dil padre, né la parlila dil Gol de Sfiogua ; siche é in gran perturbalion quelle cosse, el hanno messo pana la vita chi nomina più il Re, ma nomi 17 nar debi la Raina ; per il che il Re predillo par habi  prolongalo la sua ioooronalion dovea esser fata in  Aquisgrana, e voi (ornar in Spagna, con zente per  sedar quelli tumulti. Ifem, scrive, come per li fo-  raussitì di Napoli sono li a la corte di Pranza, se  intende la duchessa di Bari a Napoli voler Tar gran  feste per el parto de la Gola maridada nel re di  Poiana, et che Y Imperador voi investir dito fiol  nato dil dudiato di Milan ; tamen è parole di fo-  raussili. Scrive, esser vadiado una abatia a li con-  fini dil re Cristianissimo e dil re Calholioo, e questa  Maesti r ha data al confessor suo, ed il re Catholico  non voi Thabi. Scrive, la fia nata partì a di 14 per  Bles, et cussi la corte tutta partirj, siche per tuto il  mese saranno a Bles. Scrive, aver ricevuto nostre  di 99 Avosto in materia di vilani di Uriago. Par-  Ieri al Re quando achaderi, et Tara bon ofido in  questa materia. "
64,"['Oriago', 'Uriago']",259,"Di Verona, di sier Lunardo Emo podestà  et sier Francesco da eka' da Pexaro capitano,  di 29. Scrive in risposta di la letera li fo serito,  zereha il continuar di le fabriche e V ajuto datoli  di 900 guastadori di vicentina, el cara 50 per do  mesi, et di L^nago guastadori 100, laudando l'o-  pinion di lo illustrissimo Govemador, di far uno  bastion a la porta di San Zorzi, siche zonto sarà il  Govemador de 11 li parierano laudando da parte di  la Signoria nostra l'opinion sua, ponendo ordine  al fabrichar. Ma scrive bisogna si fazi provision di  danari; quella comunità è molto agravata, ha di  165* spesa più di Tintrata a Tanno. ducali 4900, come  per li conti si poi veder, però bisogna far provi-  sion di danari, volendo fabrichar, perché li danari  di la camera non si poi tocliar, sono debiti a Y Ar-  mamento, Arsenal eie., ducati 4700; però si vogli  alender e ordinar eie. "
65,"['Oriago', 'Uriago']",279,"Adì 10. La matina vene io Golegio Torator di  Ferara, et apreseniò quel schnvo che par sia scam-  pato da Costantinopoli, e robato al suo patron pid  de ducati ^ milia. Hor capitò a Ferara, et perchè  da Conslantìnopoli si ave di aver la recuperation di  quello, inteso P era a Ferara, la Signoria scrissa al  Duca lo volesse dar, et cussi con custodia Tha  mandato. "
66,"['Oriago', 'Uriago']",279,"Da poi disnar, fo Consejo di X con la Zonta,  per le cosse di vilani di Uriago, e fo leto a questo  Consejo nuovo con la Zonta il processo, et compito  di lezer tutto. Steteno 6n bore 3 di note. ^Ail. U matina» io MereAUoMiiìrOraiùr noiiri, di 5, ei di NmpoU. iK • . • Iraiùr noiiri, di 5, ei di NmpoU. iK • . • I rio dirò poilete sanilo in Pr^iadL AIiMii a di 19 Septembrio, le gaBe di Ftandn cbe capitano sier Zuan Moro qu. sier Antonio» bea caiga^ zoDse a Palermo."
