,Place,Column No.,Paragraph
107,"['Castello', 'y', 'Castello 8. Angelo']",77,"In Spagna, Toledo e Satamancba et uìoì\e altre  terre si é levate a rumor, et hanno morto li presir  denti posti per l'Imperador in ditte citta, et quelli  fcatuti, et loro voleno governar li danari e lenir per  Baine la raina Maria che è in Spagna, madre di esso  Imperador ; siohé quelle cosse é in gran garbujo.  Cui in Roma, di vacantie non zè nulla, li caldi sono  Srandi, il Papa sta in Castello e sia bene, et è più di  ZBO lomi non é stato Concistorio. Venere si dice sari  ^MT parlar una parola di questi offici, li quali sono  ^k fati et venduti. Fra do zomi si parte de qui do-  «mno Hironimo Leandro, è sopra la Libraria dil Papa,  ^^ra in Alemagna con brevi, bolle et excomunicbe a  ^^ìA darà ftvor a quel fra' Martin Luther, die ha fato  ^quelle opere. Il Papa voleva far butar zoso le mure  lì Urbino e il palazo, over li desseno 100 obstasi,  che loro edificasseno una roche ; il qual terzo  partido quelli di Urbin hanno acetado, ina avanti la  se Eni, sari quel piace a Dio: chi ha tempo ha vita.  11 Papa sta su piaceri e prepara far una sera di Avo-  rio eoli oomedie e musiche, e si tien la farà Zuoba,  perché Mercore el dezuna. Doman si farà una regata  di barche nel Tevere. Conclude, de li si sta su pia-  oeri, né si atende ad altro.  18* Leiera àU dito, di 28. Come il Papa voi iar  140 offici novi, chiamati eavalierì. Come scrisse, ne  volea prima hrne HO per ducati 1000 Tuno, e  darK te intride su le minere di aiuoli. Scrive, é te-  lare da !Ms di 90, T Imperador e il re d'ingaltara  attlSy Uai t5lMaiosiemeaCaies,epoiadìl6 partirono. Il re di Pranza noanda uno suo al Papa per nararli tutto il successo di questi abochamenti ; si aspeta che 'I zonzi."
108,"['Castello', 'y', 'Castello 8. Angelo']",404,"Di Boma, di V Orator nostro^ di 13. Come,  il Papa é a Coroelo e quelli loclù ciraimviciM a so-  liti soi piaceri, et monsignor de Pia, oralor dil Cri-  stianissimo re, a di 9 partì de qui per andar da Soa  Santità. É restato monsignor di San Marno, qiai e  andà conlra el signor Alberto da Carpi vien da Na-  poli, mia 59, per abocharsi insieme; il qual non saria  venuto se questo San Marzeo non Tavesse man^f^  a chiamar, per haver cussi comission dal re Crisiia-  oissimo di non poter far senza la soa presentia. EI  domino Zuan Mare, secretario dil reverend igi m a  Medici, li andò conlra fino a Rostia. A di 13 dito si-  gnor Alberto zonse li a Roma. É stato a visitario i  cardinali, Santiquatro, Comoet Cibo. Etiam ìm Ora-  tor nostro rha visitalo. Dimostra di esser affirionaio  a la S^ooria nostra, dicendo è venuto mal vokn-  lieri, ma non lia potuto far di meno per ubedir i  Roi. E dimandatoli si 1 stava qui disse, non fo saper,  e Ilaria aerilo al Papa e aspelava risposta; il qual non  si aita di la man sinistra, et ha mala nera. Serifi;  b dudiessa di Bari, olim di Mìhno, andava in Mo-  nia, é stala a Santa Maria di Loreto, è ritornala i a  Roma con cavali SOO alosata nel palazo dil cardinal  Cibo, a spexe dil Papa. Si dioe non va in Palania,  perdio il Re li lia scrilo é inverno, é male stradi;  poi vi é il morbo, però è meglio veqgi in altro tcni»  pò. Tamen lia inteso é ritornata, perchè Tiinpen-  dor li ha scrilo non andasse per esser quel re di IV  Iona implicito in guerra con il re di Prossiay e nen  saria s^uro il suo andar. Scrive, per la inrorwMlion  fata in Aqui^grana, a di -23 dì Odutario, Mi Ootato é slato Irato artelarie, e falò aioili fochi per la (erra. Scrive, il Papa ba revoahà tutto le expeiative, etiam quelle riservate in pectore^ siche de cmtero corerà più vaehaQtie. A di 10, bore do di ivote, morite il"
109,"['Castello', 'y', 'Castello 8. Angelo']",552,"Dil dito, di 12, Come di fanti vien di reame, il  Papa lenze li vengi contra; ma si ha di Napoli, H  hanno auto danari a sua inslanlia, el il Boto dil fra-  delo dil casleIaD andò a farli venir di Sicilia, e come  li ha ditto uno zenoese li slava apresso a San Polo,  le zente d*arme é in Napoli cavalcbano a requisition  dil Papa verso il Tronto, e si dice ptMiee per la  impresa di Ferara, e voi farli uno arsallo a b inpro-  vìsa. Scrive, eri mandò Nicolò Gabriele da dbnùno  Zuan Hemanuel, qual li dimandò di le nove dt Sona,  et li disse dille nove, poi senza proposMo disse : « t  vero il ducha di Ferara si voi maridar? > Rispose non  lo saper. Poi dimandò si Ferara era forte. Rispose  non lo saper per non esservi mai stalo, e dimandò  se Tera ona bella terra, disse ha inleso esser fortissi-  ma. Scrive, el Papa k eavalchar le genie el fari nu-  mero di fanti li in Romagna. Scrive, eri fo a palizo  e il Papa come lo vide lo chiamò, e li disse : Scrive  a la Signorìa, che uno frale Andrea di Ferara, gna  ribaldo, ha predichà a Venetia el straparla ci iiMiiiU  le vesligìe di quel fra' Martin, e ha fatto una opera;  che la noi lassi farla stampar. El chiamò domino Pe-  tro Bembo, dicendoli fate uno breve di questo a U  Signoria. Poi il Bembo disse a esso Orator, saria boo  la Signoria lo facesse prender. Scrive, il Papa noa é  ancora partito; dà fan» voler prima veder la fin di  questi fanti vien di reame. Scrive che in questi zonii,  Guzon ... era locolenente dil signor Borlolamio Li-  viano, bessendo in Banchi a eavallo, vene il bariselo  e to scavalcò, dicendo é persona dil Papa. Fu posto  in ki torre di Nona, poi la sera conducto in Castelo. "
110,['canal grande'],177,"El di Candia, fo teiere di rectori, e prevedadar general Jusiinian, di 17 Avosto. Zerdudar general Jusiinian, di 17 Avosto. Zerdu quelle occorenlie et fabriche hanno principiato t far etc       177 19 . ji iB ÌJ9. Li OMtina in Quarantia crimioal To  expedìto 3 caso di quel .... Donio di Castel Fiud-  dio, fai condusse uno suo nepote Sol di suo fra-  dello a Ugiiago, e ivi lo amazò per aver lui tutta la  rolM; il qual fo cbiamato e bandito absente eoo ti\ja»  ei cdte soi floG siano privi di la dita roba. Et naviter  Ai fimo ... et condolo in questa terra, et cussi fu  mandarlo a exeeution di la leie, viddicet  m per Canal grando su uno soler Bora una  Goo a Santa Croie» poi per terra a eoa di ca-  Tmlio tirado fino a San Marco, e in meso le do Co-  ì»MMm m desoopado ei poi squartado eie. Ei cussi  Sttl>ado se farà la juslitia. Item, uno altro li sia cavi  oebio. "
111,['canal grande'],416,"(1) U CArt* se • tSt' SODQ UftBCht. AdiSé.ÌA malioa Dulia fo da conto. L*ainha —  sador dil Signor turco fo per Ibmria fino t Rìdlo^.  acompagnalo da alcuni, ei poi mODlA io butlM,  per Canal grando andò a h Zuecha. "
112,"['Da Mosto', 'Mosto']",50,"A dì 13. La matina fu dato assa' audienlia, el 33^^  nulla fo di novo. In Quarantia compite di parlar sier  Lorenzo Bragadin per la cosa di Pario, e si portò  ben. Fo laudalo di naration et memoria. Conclude, ^ ''  questo Stado dia vegnir al signor Alberto, il fiol dil  qual sta in cha' Zantani over cha' da Mosto. "
113,"['di s. Alvise', 'Alvise']",117,"Da poi (lisnar, voleann far Pregadi per aprir la materia di le lelere di SfMgna et ferii risposta, e terniinono indusiar a Luni, pereliè fato ozi il parenti    10     '6 di sier Beniardo JusUoian qu. sier Alvise iu la fìa di  sier HoiiioboD GriU. Et Gokigio si reduse. "
114,"['di s. Alvise', 'Alvise']",117,"Da MUafè^ di Alvise Marin secretano^ di .  « • . Manda una relutiou anta dal Soprasaxo di quello  é sii trata in la dieta elvetica di sguizarì : proposto  far oratori a la Cesarea Maestà et non lianuo ubte-  WMJiOt proposto dar fovor al ducha di Virtimberg e  ^^ecuperar il suo Stado, et par a questo habino eoo-  mentilo. Et tieni, scrive coloqui auti con monsignor  ^a Tek^ni, zercha i moti di Spagna che é di fame  ^^onlo; et che monsignor di Lutrech veniva a Milan.  ' In questo zomo» in Quarantia criminal, [ter il  di Paulo Àugusliui» edam quello scrivan a le  , bavendo compito di parlar sier Marco An-  ^Doio Contarini V avogador, ozi li rL<pose sier Alvise  avocbato.  DU Qavtmador general, fo letere di Vero-  di 16^ drizate a Zuan Piero Caudino suo secre-  aario, aziò le comunichi con la Signoria. "
115,"['di s. Alvise', 'Alvise']",117,"A di 19 Domenega. Fo santo Alvise, et fo il  perdon di colpa e di pena in dita chiesia, comenzò  eri 6 dura per tutto ozi. "
116,"['dei Birì', 'Birì']",593,"Po leto le leiere di Franga e di Ruigo eie. Fo  posto gnitie e parte parlicular, non cosse da conto.  Noto. Il ducha olim di Urbin Francesco Maria di  Rovere, partito da Manloa, licenlialo dal Marchexe  suo cf^inato per esser fato confalonier dii Papa,  ▼ene a Padoa, et donnan a di . . . Fevrer veri a Ve-  neti;!, alozato in caxa di sier Donrienego Zorzi qu.  fBicr Alvise suo amicissinoo, questo, auto licenlia dal  Gonscjo di X di |ioler venir el habitar in questa  t^rra per esser libera, ma star secreto. "
117,"['dei Birì', 'Birì']",593,Eri sera fo fata in Biri una comedia molto bela 
118,"['dei Birì', 'Birì']",593,"^axadooa, el qual poi parli per Zara. Scrive, bisogna "
119,"['dei Birì', 'Birì']",593,"ditionade e bisogna forlificarie, imo in alcuni lodii "
120,"['di 8. Benedetto', 'Benedetto']",429,"Vene ii conte Antonio Martinengo fofloi di do-  mino Beniardino oiladin brexan et aentilhonio no-  stro, qual ha di conduta SO bomeni d'arme et 100  balestrieri a cavalo, e li sia donato il caste! di Ser-  mion sul lago dì Garda, nel qual voi spender ducati  800 a Tanno. E il Principe e H Colegio li de* bone  parole, ma nulla averi. È zovene, ha «ntrada ducati  5000 et Domenica passala, a la Testa dì mer Hironi-  mo da Pexaro a San Benedeto per la fia maridada  m sier Piero Grtmani di sier Francesco, volse esser  ftceplato in Ja compagnia di OrMani, el cussi fo  acetato, et vd dar in questa terra una cena sontuosa  a la compagnia. "
121,"['di 8. Croce', 'Croce']",462,"Da poi disnar, fo Gran Consejo, et fo gran nu«  mero di zentilhomeni, et in scurtinio eramo numero  %8. Fu fato do Gonsierì di Venetia nuovi, zoédii se»  stier di Osso duro sier Zorzi Pixani dotor el cava*  lier, fo consiei^, vene per scuKinio et rimase in Gran  Consfjo sier Daniel Renier, fo savio del Conscio, di  ballote . . ; et dil seslier di Santa Croze rimase sier  Polo Donado. fo podestà a Padoa, qu. sier Piero e  e tutte le nove passoe. "
122,"['Giudecca', 'Zueca']",397,"Noto. L*orator dil Signor turcho é con boche 8  eoD lui; li fo dato ducali 4 al zorno per spexe. Que-  sta matioa si dolse et era in gran colora con sier  Matio Alberto oficial a le Raxon vechie, dicendo ha  forsi 15 cristiani e li voi far le spese, et maxime  quelli di do bregantini di Ragusi, umde fu conzo di  ordine dil Coiegio darli 6 ducati al zorno, et lui si  mandi a comprar. È alozato a la Zuecha in cha' Ma-  iipiero. "
123,"['Giudecca', 'Zueca']",416,"(1) U CArt* se • tSt' SODQ UftBCht. AdiSé.ÌA malioa Dulia fo da conto. L*ainha —  sador dil Signor turco fo per Ibmria fino t Rìdlo^.  acompagnalo da alcuni, ei poi mODlA io butlM,  per Canal grando andò a h Zuecha. "
124,"['Giudecca', 'Zueca']",487,Zueca botege di ducali 40 per una pagino 
125,"['Zueca', 'Giudecca']",397,"Noto. L*orator dil Signor turcho é con boche 8  eoD lui; li fo dato ducali 4 al zorno per spexe. Que-  sta matioa si dolse et era in gran colora con sier  Matio Alberto oficial a le Raxon vechie, dicendo ha  forsi 15 cristiani e li voi far le spese, et maxime  quelli di do bregantini di Ragusi, umde fu conzo di  ordine dil Coiegio darli 6 ducati al zorno, et lui si  mandi a comprar. È alozato a la Zuecha in cha' Ma-  iipiero. "
126,"['Zueca', 'Giudecca']",416,"(1) U CArt* se • tSt' SODQ UftBCht. AdiSé.ÌA malioa Dulia fo da conto. L*ainha —  sador dil Signor turco fo per Ibmria fino t Rìdlo^.  acompagnalo da alcuni, ei poi mODlA io butlM,  per Canal grando andò a h Zuecha. "
127,"['Zueca', 'Giudecca']",487,Zueca botege di ducali 40 per una pagino 
128,"['Lido', 'San Nicolò']",287,"Dil dito, date in galìa a Corfù, a dì 27. Scrive, per sier Alexandro Contarini, vien a disarmar. Avisa, dito Synan rais andò di Barbaria aimar. Avisa, dito Synan rais andò di Barbaria ai Signor turco con do fuste, el apresenlò al Signor 90 puli, 5 lioni, et do capi spagnoli da parte de suo fradelo Barbarossa, domandando una bandiera dil Signor, e li bassa non gè la volseno dar, et feno apichar li do capi spagnoli, et vender li puli, e poi slato zercha uno mese, lo expediteno, con dir volerli dar bandiera ; ma ben manderia con lui uno homo schiavo del Signor, a veder il paese et tornato poi li manderia la bandiera. Il qual si parti da Costantinopoli con ditto schiavo e con la letera dil Signor et uno mandato dil nostro Baylo, con 20 homeni per fusta, et zonto a Meteliu, armono le fusle di homeni di mal far, stati corsari, e com- 179* prò la mila di una altra fusta per ducati 90 et cussi feno conserva, et a Negroponle robò G turchi et altre robe, et veniva zercando di far danno a chi in mar havesse trovato, et verso Cao dil Ducato prese uno gripo di Malvasia con homeni 16 suso eie. Scrive, come le tre galle era con lui Provedador solo Coron, videlicet Arbense, Vejana e Petratin, le messeno a sacho. Fa processo, e di le gente inquisition per notar il lutto quello recupera, et haquisition per notar il lutto quello recupera, et ha posto de 11. Scrilo a Costantinopoli di questo eie. Avisa, ditto Synan ruis, è anni 45 e corsaro, ha so Ool eoo lui. Avisa come inanda le galle a di* sarmar, che zoozeraDO quelle vien di Opro, qual  eiiam manderano a disarmar, perchè se li provedi  di danari etc. "
129,"['Lido', 'San Nicolò']",287,"Di sier Zuan Moro^ capitanio di le gatìe  di Fiandra^ date in golìa, a Palermo, a dì 21  Setembrio. Scrive il suo partir di ADiona, e poi di  Sao Doardo a di 10 Avosto, et per tempo stete  fino a di 15, il di di la Nostra Dooa; quel di si  levo, et a di !28, zoiize li a Palermo. Ha tochato  Cades, Armeria, et Malicba; et saria venuto prima;  nn avendo in conserva uno barzoto di Majoricha,  el qual navegando se li rupe Tallraro, unde oon-  vene esser da le galie remurchiato, et cussi a sal-  vamento rha conduto 11 a Palermo; il qual il bar-  zoto et le robe è suso, tien tutte esser salve me-  diante ditte galie, et cusd quelli di Palermo lo di-  cono con grande honor di la Signoria nostra. Avi-  sa, a la Fagagnana esser barze 1^ spagnole con fanti  suso. A r Austa dioesi esser una armata nova di  Fmnza, siche andrà riguardoso etc. "
130,"['Lido', 'San Nicolò']",287,"Po leto un capitolo di letere partieular di tier  BertuMi Contarini qu. sier Andrea, scrive di  20 di Palermo. Avisa il loro zonzer lì per esser  patron di una de ditte galie di Fiandra, e come li  a Trapano e Fagagnana é Tarmata Ispana, ma mal  in ordene. A TAusta mia 18 di Sardegna Tarmata di  Franza di vele 90; et a Cao Passero 4 galie e 3 Tuste  di tnrcbi. "
131,"['Lido', 'San Nicolò']",287,"Di Boma, dil Gradenigo araior nastro, di  2, Come pariò al reverendissimo Santiquatro, zerea  h eossa di Coriziola ; qual li disse soa signoria era  stato eon domino ^oatio, e li doveva venir a parlar  per veder di prender qualche sesto insieme. Et poi  domino Igoatio li vene a casa a parlar, et parlando  dovesse far revoehar li brevi, et si hsase Tar justitia,  180 disse non H pareva onesto fusse judicata da quelli  sono judici e parte, tratandosi maxime dil loro in-  teresse. Lui li respose a Venezia si fa justitia, et fu  fato in favor di judei per una senlenlia di ducati 13  milia et conira la Signoria. Or era con lui uno frate  Morganto, qual disse altamente che si dovea far ju-  dicar questa cossa da judici ecclesiastici e non da  hici, perché si sapeva la Signoria volea dar queste  possession a la francation dil Monte Nuovo; al che  lui Orator li disse poriava mal e tristamente, e che a  Venetia si feva Justitia. E lui disse, a San Nicolò di  Lio fo tolto certi tereni etc con altre parole, ut in  litteris. Or ditto Orator andò dal Papa, e parlandoli  di questo, Soa Beatitudine za era sta informata da  domino ^atio, e li disse tutto quello li havia ditto  esso domioo Ignatio» e con queste posaesMOo ai voleva franchar Monte Nuovo. E T Orator disse t Sot Beatitudine la gran justitia si feva a Venetia eomiru infideles non che con tra frati, e a li Piovegi craBO descritti tutti li conGni di Laguna di Venetia, eh^é h forteza di questa citi, pregando Soa Santili revocar li brevi. Rispose voleva coosejar b Scrive, lui Orator nostro, domino Ignatio é fiorailiiM^ fradek) di chi ha la signatura, et pel assau QmI E disse, parlando con lui, sapeva h Signoria N fama serito solo una volta di questa cossa, e lui 9etii|»ea la toleva cussi calda ; siche i sanno il tutto, peri « bon la Signoria scrivi caldamente di quealo ete."
132,['Rialto'],76,"fo questa matina, fo pubfick in Rialto Ha parie  presa nel Conscio di X, a di 36 di questo : che Gmdo  dd Cason da Seravale e Marco Antonio di Val de  Marin incolpadi aver proditoriamenle amaalo in Se-  ravale Hironimo Racola dtadin de i, eontra M co-  mandamento ei amonilioo faloii per M Cai dd Goo-  sqodiX. /lem, qidli dtri come complid, Ldio dd  Gisoo, Jolio suo fmddo, Andrea de liberal. Miro»  mo dd Cason, Alvise dd Cason, Vetor dd Cason,  Francesco Garda, Sandro de Mio todesco e Andrea  Mautoan, tutti debano comparir a le preson in ter-  mene de zomi 15, e, passadi, d procederà eontra di  loro, liem, eri fo chiama in Rialto, per parte presa  ud Consejo di X, Francesco Contarininaturd deder  Salvador Contarini qu. sier Piero ei Sdvador Loop^  incolpadi di violentie commesse eontra una fanena,  in casa propria, con bote, biasteme, pwule e atti io-  domitii, debano apresentarsi ai Cd in tenaine dì  zomi 8, aUier si procederà contri di loro^ fa  abseotia non obstante. "
133,['Rialto'],88,"A dì 3. Venere la matina, poi terza, il Serenisi  Simo si fé' portar, e andò con li Consieri per Palaao  come fé* za 8 zonii, persuadendo li judid a far ju*  stitia. È da saper, dde voce voler andar Luui, di' é  San Salvador, a veder le faoricbe di Rialto, et andar  con li |iiali in cariega porUto, dove é sta posti ne le dille fabrtche do epitapliìi ool nome suo suso, el poi andar a veder la fabricba di San Salvador nuova el n udir messa. Tamen non so quello farà, e vecbio e di complexTOU debile; tamen in Colegio, Consejo dì X e Pregadi non roandia mai."
134,['Rialto'],90,"Fu posto, per li Savii dil Consejo et li Savii di  Terra ferma, una parte : cum sii che si ritrova 4  botege in Rialto nuovo, quelle siano vendute a T in-  canto a danari dil Monte Nuovo, con questo li Prove-  dadori sopra il Monte Nuovo dagi ducati 800 per il  fabricar di Rialto. E il Contarini e Trevixan voi com-  pir di sora la stajera et il Veuier voi compir il por-  tego di Visentini ; el sopra questo sier Moisé Venier  preditto andò in renga e disse la soa opinion, el li  rispose sier Francesco Bragadin savio dil Consejo,  dicendo, fazendo sora la stajera, si sparagna olRcii  che si paga in volte ducati 200. Hor il Venier nulla  messe, el andò la parte et fu presa, ave 1 1 di no;  176 di si. "
135,['Rialto'],96,"A dì 6, Luni. Fo San Salvador. Il Doie si molò  et non volse andar a Rialto né a San Salvador a ve-  der la chiesia nuova, e in Colegto non fo teiere da  conto. "
136,['Rialto'],150,"Preso la parte predila, e sia publicà per le scale.  Et venendo, sia frusta a . . . . Rialto et sopra uno  soler in mezo le do Colone sia bolato di 4 bolle e  rimesso al bando; la seconda volta li sia taja la man  destra. "
137,['Rialto'],190,"Kafendo l'offiUo nostro sopra le Aque a (ar onlte execolioa importantissime, le qual rizerchano gm'iamma di danari, dovendose quelli Inzer per ■fai Tia che de angarie, ehtrovindose molte palate ne k qual se meleno patatieri et scrivani per cadauna pihta el quelli sta a meler a li ofHcii di Govemadorì el Gilbaveri jiro tempora come ì mancano, et però randerft parte: che per aatoritb di questo Consejo, lia proo che da poi h morie di cadian di palatieri el lenvanl predìtU, et etiam compile le expetative, W «bsDa ne fuM che l'offllio predllto sopri le aque de presenti per via de incanto over per qualunque  altro modo che sari deliberi de poter Iraser maior  quantità di danari, possi dar a chi più ofieriri le pt-  lade et scrivani prediti, con le condition ìnfrascripte,  che coloro le lorano per via de incanto over allra-  menle, quando quelli che li hanno venìrano a inan-  ellar, posino meler uno al ditto exerdlio de pala  n've scrivania, el notarle in nome di cui el vorà che 136 '  sia apio el idoneo a tal exercilio, el quelli possi gal-  deret usufruir per lutto il tempo de la vita sua;  e se i maDChasseno avanti cbe liavesseno quelle go-  duto anni 15, possino isoiberiedi et successori ^-  derii fino a compimento de dilli anni 15, dovendo  esser aprobati in Golzio per balole 15 di quello ad  mitiHf, con obtigalion al priocìpal condulor cbe vo-  lesse substituir in suo luogo, de emendar ogni eror  et eonlrafazjon qual fusse coraessa per essi subsU-  tuiti in suo luogo, intendaitdo sempre che quelli che  i meterano ad esercitar dHle palade, et scrivani,  sano epti et sufficienti a tal exerdtio et quello  exereili ben et l^lmente. Et simiUter li pràdilti  Savii sopra le aque, passino meler et depalar, con li  modi et condition soprascripti, li bastasi cussi al  Fonlego di San Marco come di Rialto da poi la morte  di qudli che de pretenti i godeuo, et da poi che  sarano compite tulle le expetalive, se alcuna ne  fusse; et questo medemo possino far de li mesu-  radori di formento et de sazadoh dil sai. Di parte  123, 72 di no. "
138,['Rialto'],193,"il A 18; La matina li Consieri veneno in Rialto  per incantar le galle di Barbaria, et la prima Tu deli-  bevuta a sier Antonio Donado qu. sier Bartolamio,  per ducati uno, e le altre do non trovono Patron,  siche rineanto andò zoso. "
139,['Rialto'],204,"sier Nicolò I90L     Fa posto, per li Saviì dil Gonsqo e Terra  sia dato libertà dil mexe di Zugno passalo a li Pln^  vedadori sora le vendition di beni di h Sigaorii no-  stra per Granchation dil Monte Nuovo, di poter lea-  der libere al puUico incanto le volle e bolqge di  Rialto, oltra il deposito fato in quelle a lanlo Moate  Nuovo. Et perchè dH 1519 in qua le dille som Mi  aflitade da li Provedadori sopra k fabriche di KaKn,  loè multe botege, con condition che li eondalori éi  quelle non passino esser caiadi per aleon caso arivo  non pagando al tempo gli aiBtti loro, la qaal a6laaaa 1  non la poteano far senza la Sberla di questo Conwin  perchè si poi reputar alivehte, per lanlo aia preso  che le dite aGtason, in quella parte non poter  cazadi, sono tajale, et restino pure localioD  dieno esser: 176, 91, 6. "
140,['Rialto'],279,"^ di 9, la matina. Non fo letera alcuna da  conto, ni cossa di momento. Fo pubfichl in Rialto  una condanason fata a di 5 di V istante ne Texcelen-  tissimo Consejo di X contro Hironimo di Piero di  Merehadanti veluder per sodomito, absente, ma le-  ntamente citado, ebe 1 ditto in perpetuo sia bandito  di questa terra e lochi nostri dal Menzo al Quamer  in qua, con taia L. 1000, et beasendo preso li sia  tajà la testa in mezo le do Colone, e il capo poi fato  in cenere. "
141,['Rialto'],336,"K da saper, in questo zomo, in Quaranlia crimi i  nal se menò uno caso di una mala qual lajò la tesls  a urta pula a San Trovaxo perché la molestaTa. ftsi  presa, et fato il processo, li Signori di noie b man-  dò a la leze, et li Zudexi di Proprio non fono d'ac  cordo, però che sier Marin Bondimieresier*  Baxadoiia voleano li fosse tajà la testa, el sier  Dandolo non volea, ma fusse confina in vita eie. Hoim  andono in Quaranlia poi disnar, el menala la disse ^  < Feme cavar questa anima fuora de sto eoqio,  Dio vi farà dil ben. Che bisogna tanta zente? voi  che amaza qualche fia altra? chi de gladio ferii ip  gladio perii. > Hor il Dandolo introdusse il caso^  moMstrò per le leze civil V Imperador haver ordhii  li mali fanno homicidio li sia perdona la vila, ma  stiano in loco in destrcta. Poi pariò sier Midùd Ba«  xudona alegando un caso, pocho é, che un malo am*  mazò uno in Rialto, lì fo fato lajar la lesta. Hor  questi do Zudexi e li A vogadori messeoo li fosse Ugà.  Ave 1 1 . Il Dandolo, Consieri e Cai di XL el Vieeeù  messeno fusse confina nel caslelodi Padoa a morir;  la qual stesse con U ferri ai piedi, questa ave tM> el fo  presa. El nota, eri fo messo in preson uno altro malo  amazò do; quel seguirà di lui ne farò noia qui  avanti. "
142,['Rialto'],351,"Fo in questa matina proclamato in Rialto, per  deliberation dil Consejo di X, di chiamar preso che  uno Mario Saraxin schiavo di sier Alexandro Pi-  sani, et uno Jacomo Fachin famejo dil predito sier  Alexandro Pisani, incolpadi di aver asaltà di note  Zuane vice capitano di le barche di lo exoelentis-  simo Consejo di X, che tutti do io termine di zomi  8 vengano a presentarsi, aliter si procederi contra  di loro la sua absentia non obstante. Nota: altri zen-  tilbomeni fo, ma non è chiamati. "
