,Place,Column No.,Paragraph
0,"['Brussa', 'Bursa', 'Asia minore']",645,"Di Caramamelh corsaro prese li navìUi di Ondia, disseno li bassi è ribello dil Signor e saria boadia, disseno li bassi è ribello dil Signor e saria boa la Signoria lo impedisse non podesse andar in Ba^ baria. E querelando esso Baylo di le 3 fusto prese li gripi dì zeDabrìi et arzeoU vivi sora Seda, eome par  la Signoria habi scrito di 20 NovembriOi qual non  r ha aute, risposano è ribelio di! Signor turco, et  Peri basse e Mustaia bassi replicò far arniada lutti  do coDtra diti corsari, e meter li horoeni suso, come  scrisse, per espurgar il mar da corsari. Scrive, il  caso di Simplicio Rizo, che ba porta via assa' danari,  li ba dà assa' da che far. Ha oblenuto la liberation  di le robe di sier Andrea Morexiui di Àleppo e auto  letere a Bursa le consoni al suo nontio, el qual  iiontio dil Horexini é partito per andarle tuor. Uà  inteso barze francese a Baruto ba posto in terra  ma non hanno fatto nulla, et che francesi su le aque  386 di Candia tolse alcuni vini di nostri naviglii con dir  erano di zudei. Scrive, che si provedi di danari per  le pension dil 2ante e dil tributo di Cipro. Ha aviso  di Alepo, il Zacaria^ vene li con il tributo, poi ritornò  in Cipro etc. Scrive, si elezi il suo suecessor. "
1,['Burano'],120,"Fu posto, ozi, per li Consieri, una taja per letere di sier Andrea Foscolo podestà et capitano di Crema, di 2 dil presente, di certo homicidio seguito perma, di 2 dil presente, di certo homicidio seguito per Batista dil Soldato in la persona dil qu. Joanne Campagnalio ut in litteris: che 'I possi di novo proclamarlo et meterio in bando di terre e lochi, e di questa cita, et con taja vivo lire 600, morto lire 300, e lì soi beni siano conGscati ut in parte. Ave 1 47 di si, 7 di no. 78 In questo zorno, per Colegio, fo scrito a l'Orator nostro in Corte: come il Pontefice za do anni pertor nostro in Corte: come il Pontefice za do anni per sue bolle ne rafermò la eletion di piovani di questa ella da esser confirmati per Soa Santità, ma fo pretermesse de nominar le Contrade, videlicet Mu-termesse de nominar le Contrade, videlicet Mu nì n, Mazorbo, Torzelo e Malamocho, che sono an-  nesse con questa cita nostra; pertanto voy instar il  Papa dechiarì questo instesso modo si observi in li  piovani da esser electi in le pieve di ditte Contrade.  Et a di 18 di questo, fo sento a sier Alvise Sa-  lamon podestà di Torzelo, in risposta di soe di 16,  zercha il monasterio di San Cornelio et San Qpriano  di Buran di mar, qual va in mina perchè non si  celebra, e sarra bon farne provision etc. Però li fu  scrito, per Colegio, sequestri le intrade e di danari  sia reparala la chiesa et monasterio che'l non rovini.  Itemj a di 17 fo scrito a sier Alvise Gradenigo  orator nostro in corte : come parli al Papa perché  ditto monasterio è in comenda a domino Gratian di  Gratiani, qual è residente li a Roma e raro vei nun-  quatn si celebra e tutto va in mina, et il meglio  sarta che uno monasterio di done observante di San  Arian apresso Torzelo, le qual per il mal ajere che  vi é stanno pid di la Vs dil tempo esse donne fuora  del ditto monastero, perchè vedi il Papa concedi  ditto monasterio di San Cornelio et Cypriano qual  sia unido con San Arian, con dar pension onesta al  prefato domino Gratian, et questa bona opera sarà  la reformation dil monastero di San Arian. "
2,"['Chioggia', 'Chioza']",147,"guato da lutli li doclorì exceplo sier Nicolò Michiel,  né altri vi Tue. Hor questo referite in Col^o la con-  dition di Cbiaza, la qoal Ta anime 10 milia, di quali  è liomeni alende al navichar n. 1000, vanno per  luito con le loro tnrche da 600 e più stera n. 40,  e vanno securi dal mar 6no in Candia e in Alexan-  dria ; dubitano di corsari sono da zercha barche . . .  ei cùndusive, Chioza é povera. Di l' ini rada non  disse, per esser di la comunità. La Signoria ba so-  ìum le 30 et 40 per 100, e li danari di le dezime  per se quando le se meteno. Disse di sali, come sono  saline n. S34, di le qual 94 é andate di mal, et cbe  non si lavora il resto con danno grandissimo di la  Signoria nostra, per una parte presa nel Consijo dil  sai dil 1518 cbe non voi si fan sai bianco si non  certo numero ; la qual parte è causa non si fazi.  Disse poi altre particularìtà non da conto però, et  fo laudato dal Doxe, justa il consueto.  96 Et sier Sebaslian Moro, venuto Provedador di  Gorfù, compite de referìr la sua l^tione el di quelle  cosse di Gorphù ; e come ha trova gran desordeni ;  le porte erano serade per uno che stava nel borgo,  et si poteva dir in le so* man era Coriù, e si mera-  vcja non sia stì robato. Ha posto ordine le chiave  sarà in man dil retor, la note. Disse aver fato una "
3,"['Chioggia', 'Chioza']",298,"Poi pariò sier Francesco Bragadin savio dil Con*  segio, in &vor di la lelera, dicendo questa opinion  dil Trun é molto subita, et visto Deeem Qm$ilium  sequitwr preBsmtiamy et che quando faremo questo  depotentia^ il Papa ne scomunicherà ; ma prima é  bon veder si de plano polemo oblenir V intento no*  Siro, che mai mancherà a far de potentia^ biasi-  mando mollo il Trun. Poi parlò sier Harin Morezini  é sora le Aque, qual contradise elici» a la lelera, o  si doveria for gajardamente contra questi frati che  voi predichar contra questo Stado, ma semo miti ;  dicendo il Dominio nostro non dia aver alcun rispeto  quanto a far una cossa li toma la salvation di la sua  terra, e che le Lagune é le mure di Venelia.Per que-  sto aterar V ha iato i frati. Chiosa é in terra; con al-  tro parole. Poi parlò sier Gasparo lialipiero, é sora  le Aque, etiam contra la lelera e contra Topinion di 187  sier L4ica Trun ; el volendo continuar a pariar, sier  Marco Uinio e sier Hironimo da cha* da Pexaro con-  sieri messeno, elenio é Thora tarda, et per consultar  meglio la teiera si ha a scriver a Roma é meglio  questa maleria indusiar; el cussi senza altra baUo-  talion li Savii fono contenti. Et questo vuol li frati,  che la cossa vadi in longo. Et si vene zoso di Pregadi eoo gruidiaBmiì cndeon comanda di qoesla maleria, a bore do di noie."
4,"['Chioggia', 'Chioza']",303,"Fo aerilo a TOrator nostro in eorte^ digi al magnifico domino Zuan Hemanuel orator di la Cesareagnifico domino Zuan Hemanuel orator di la Cesarea Maestà, havemo aerilo a Verona fazi diligente inquisilion dil caso sequito a la Chiusa, et hesseodo, fazisilion dil caso sequito a la Chiusa, et hesseodo, fazi relassar. Fo sento eri a sier Alvise Bod dolor podestà di  Chiosa, S corieri vieo di Fioreotia si doleoo de li of-  ficiali de li TieD aperte le boizele di le ieiere; dod  (iizietc.  189* Adì 19. La inatiiia doq (o Dulia da conto di  far nota. "
5,['Dese'],169,"Poi intrò che al partir suo la Cristiaoisiiiia Maestà de more li havia donato una catena d'oro, poieastà de more li havia donato una catena d'oro, poiea valer zercha scudi 450, la qual però ooo ta porlo io Pr^di, e sopra questo parlò lungamente, dieeado é sta preson in Pranza, e pagata la taja e loHoK ooo prexon li fu dato domino Andrea Leslaoer, qoal si tolse taja ducati 2000, el però lui tolse doeaU aOOQ, poi fo lassalo e lui pagò li ducati 3000 di tejaL È stato in questa l^tion apresso anni tre, e io questi coloqui di reali ha speso assai, perché, olirà le spei^ di viazi, si convien far honor a chi si rapreseote. et ha speso assa* dil suo; però reehiedeva, per teole fatiche che mai ha recusalo de andar a servir questo Stado, per il suo star in prexon in Pranza, aziò sia conosuto il suo servir esseme sta grato, sicome fii fato a domino Marco Dandolo venuto orator dil re Cristianissimo, edam slato prexon, che li fo donado M «a cadena, cussi suplieava questo segno fusse falò io  M ui, eoo molle parole ben dite a proposilo. Poi laudò  fironinao da Canal suo secrelario, qua! era li pre-  ^ che beo si havia porlato eie. Et compito, vene  di renga : laudato de more. "
6,['Dese'],169,"lontanar de le pallude nostre le aque dolce, le qual "
7,['Dese'],169,"ogni mioima inoodation rompeno, et de dita ope- "
8,['Dese'],169,o a proveder per la indennità di ditte Lacune no- 
9,['Dese'],169,Ire e( cercar de lontanar le acque dolce più sia pos- 
10,['Dese'],169,parte : cbe eum il nome del Spirilo Santo el sia 
11,['Dese'],169,i sotto el ponte de Botenigo et dove se conzonze 
12,['Dese'],169,"que salse, dove m^lio vegnirà a corresponder cum "
13,['Dese'],169,"^ ''open si ha a far de la Brenta fin dicti luogi, an- "
14,['Dese'],169,"v*aoo deputati parerà, dovendo poi scorer dita aqua "
15,['Dese'],169,"l^io discorer verso el Dexe, sia cavata la fossa chia- "
16,['Dese'],169,omU la Desfeoa che è de là da Mestre per condur 
17,['Dese'],169,"le diete aque al Dexe, et de basso serar le aque al "
18,['Dese'],169,"cavamento el serali ditti due lochi, tulli li canali del "
19,['Dese'],169,Botenigo el cavamento de Margera e Liza Fusina re- 
20,['Dese'],170,"vadino suso quanto pili le pono, et habiNo più corso a le Ucune nostre, et siano causa de extirpar tutte le  canne nassule si nel dicto alveo novo come in ditti 113*  canali, cbe sarà total beneficio non solum di le La-  cune nostre predite, ma etiam purificazion de Taere  di questa nostra cita. Nec non sia cavala la fossa  chiamata la Gradenica, la qual é apresso la strata re-  cto tramite fino al canal di san Lorenzo di Mestre.  Et da mo' sia preso : che in primis et ante om-  nia principiar si debia el ditto cavamento novo di  le pertege 301 1 cum li arzeri potenti da resister da  quella banda a le aque dolze che penetrar non pos-  sino in la lacuna nostra, et similiter che da quella  banda fortificar et reparar se debia li arzeri de la  Brenta per il medemo effeclo, et similiter la De-  steoa cbe va a la via del Dexe, come di sopra e dicto.  Quo facto^ remover se debia el Caro et Tarzere dove  é fuiKlato esso Caro de Margera per aprir la via a le  aque salse, et non pi*ima per alcun modo : decbia-  rando che tutte le terre che al presente non sono  lavorale non se possino redur a cultura, ma riman-  gino tutte a pradi, dovendose però obturar et stro-  par tutte le gore et sboradori cbe cadauna di dito  terre lavorate bavesseno, le qual butasseno in alcun  de li canali preditti, cussi da la banda del Botenigo  verso Mestre, come da li arzeri de la Brenta fino al  Botenigo, da la dita cava in zoso verso le acque  salse, aziò iK)n sia dannificata la Laguna nostra, sotto  irreniissibel pena de perder le terre, le qual ipso  facto se intendino esser confiscato in la Signoria  nostra, un terzo de le qual sìa de li acusador e li  doi terzi de V oiieio nostro sopra le Aque, da esser  convertilo el tracio de quelle a beneficio di la La-  cuna nostra. Et siano tonuti li Savii nostri sora le  aque presenti e futuri circha diete |)ene a exequir la  presento deliberation, sotto debito de sacramento et  pena di ducati 500. "
21,['Dese'],170,De parto . . 131  De non ... 17  Non sincere. 17 
22,['Dese'],170,"Da poi disnar, non fo nulla, li Savii si reduseno  poi vesporo. In questa notte passata fo grandissima  fortuna di vento, adeo alcune barche anda\*ano a Lugo è àllj^ A Mak-gert pé^ à^da^ a T)*6yì8o, d la Mddona si roversono e alcuni si anégoDo."
23,"['Fratta', 'Polesine']",143,"Fu posto, per li ditti, non era -sier Francesco  Bernardo: atento die tutte le rol)e vien di Fiandra,  Alemagna e altri lochi, capitano a Verona e per via  di Hostia o?er di la Polesela vanno a le fiere soto  vento e altri lochi alieni, però sia preso, che tutte  saize, tapezarìe, tele, pani e tutte altre robe capita-  no a Verona, si de Ponente, come di terra todesca e  ogni altro loco, prima pagi li dadi consueti a Vero-  na, poi fazi le bolete per transito qui e non per al-  trove; dove zonte in doana di terra, siano poste in  uno magazen separado e pagi, oltra qudlo é solito  pagarse in le terre nostre, ducati uno e mezo per  soma di peso lire 500 a la sotil, ne si possi aprir le  baie si non per venderie de qui, e si tolesseno altro  camin per non andar a le fiere sotto vento, possino  le ditte mercadantie esser tolte per contrabando.  liem, il dazio posto a le dite a la Polesela over a It  Frata, per parte presa a di ^8 Noveml>rìo passado,  sia revocbato. Item, di qui pagi la miti di le spese,  ut in parte: 146, 18,^.  93 A di 39. ¥o san Zuane D^hdo. Fo Col^ di  le biave. Et fu preso certe parte et ordeni, atento  non vico rormenti di Ravetia qui, conoe prima so-  leva, perché li merchadanti vanno a comprarti de  R, ei li incanevano, et poi li trazeno per le terre  nostre, però sia preso che de attero alcun subdilo  nostro non possi far tal comprede per lassar li for-  menti de B, ma ben quelli adretura forti condur in  questa terra, soto pena etc., nt in parte. La qual  fo publicata in corte di Palazo a di ultimo ditto. "
24,"['Fratta', 'Polesine']",143,"Fu fato ai X offidi sier Benedetto Trun qu. sier  Michiel, qual intra in loco di sier Nicolò fio di suo  fratelio e lui lo fece; é di età di anni 70, e mai ha  auto offitio. "
25,['Gambarare'],194,"Da poi disnar, fo Consqo di X con la Zonta, et  sempliee. Et fono sopra li vilani di le Gambarare et   13 expediteno . . . absenti, videlieet b«iidizali come di solo scriverò; et li presenli non poteno expedir. É processo di 100 carie, rimesso a uno altro Conscio. Il Doxe vi fu, et vene zoso il Coosejo a la seconda campana."
26,['Gradisca'],308,"Dil dito, ivi a dì uUimo. Eri fo a palazo con il  nontio pontificio per esser San Mìchiel, per andar a  la messa con la Cesarea Maestà, credendo, per esser  di Tordine, avesse Tabito come é il consueto portar  in tal zomo. Quella non havia, scusandosi li stÀ averlo  lassato a Holines. Scrive, il Gran canzdier averli par-  lato di ordine di lo illustrissimo Chievers, come é sti  con quelli dil Coosejo di Inspruch, a li quali disseno  la causa non hanno mandato li agenti in Friul per  tratar le differente aziò si vivi li subditi in pace.  Quelli di Inspruch risposeno la colpa e dì la Signorìa;  averli scrito avisi il zorno si dieno trovar, e mai  hanno auto risposta, unde TOrator disse questo non  poi esser, perché Ve uno anno lui solidta tal andata.  Disse poi esser le letere sia sta ordinate per il Con-  sejo di Inspruch, ma non mandate. Poi disse, per  questo la Signoria non dia restar di pagar li scudi  30 milia per le trieve, perché hanno visto li capitoli,  non che si mandi a veder ste differentie, ma si Irati  dil quarto di beni di rebeli, el havendo il Re Ma-  nin e Gradisca, quelle ville dia esser sue. L' Orator  li rispose é falso, ut in litteris^ e se dia restituir i  beni di subdìli, e lui Gran canzelier, volendo parlar  in jure, concluse in Aquisgrana sarà altri dil ditto  Consejo di Ispruch e si vederà. Poi disse saria boa  la Signoria mandi a tratar di qui quelle materie che  si manda de li, e non si manchi di dar li 20 mila  scudi. L' Orator rispose si farà come fa a Verona,  che fu dato li danari di scudi 30 milia, et nulla Tu  fato. Rispose il Re voi il tutto, e in quello si poterano  componer, si concluderà: se resterà differentie, il  Cristianissimo re sarà judice. E questo disse, perchè  r Orator disse non e onesto vui siate judici e parie.  Scrive, monsignor di Chievers ha concluso et é sta  posto in possesso lo episcopo dì liege di F abatia, "
27,['Gradisca'],496,"Dil ditto, di Ì7, in*. Scrive, zercha li 30  ducati il Philinger solicita, et volendo aver te lelcn  dite, par Soa Maestà intrasse nel Gonsejo e  gna ron nuMisignor di Qiievers el Gran  e altri, e intrato chiamono dentro el conte Crìstolb-  ro Frangipani, qual stato un pocho ussi fuora iboIIo  aliegro, e persone si al^rava con lui et pncijfme )  li foraussiti. La causa fu perchè fu ekto j'^pitMi*! ji  Maran e Gradiscila. Per il die, oognosceodo il ani  animo dil ditto conte Cristoforo verso h Signoria  nostra, pariò al Gran canzelier, dioeudo questa ck-  tion é routraria al voler di la Cesarea Maestà, qoal  voi ben convicinar con la Signoria nustn, dicendo  le raxon non si dovea mandar dito Conte, perchè si-  ria incitamento di guerra, e la Signoria manderi  zenle in Frìul, e cussi si principierà gariiuio. Lri  Gran canzelier disse non é da pariar, perche era sii  deliberà nel Gonsejo, perdiè lui ha pratica in qvrih  lochi, poi é benemerito per esser stato presoo ìm  questa terra, poi il Re spende mandando costui du-  cati 5000 mancho di quello spendeva ; e V Oralor ii^fse h Ccsaren Maestà non doveva vardar a l\ì ngno in lanta cossa; con altre parole sapientissìdite per lui Oralor. Hor ozi, dito Canzellier li hadite per lui Oralor. Hor ozi, dito Canzellier li ha ilio aver parlato al Re di quello; ma non c'è rimedio* non lo voi revochar, ma ben li darà tal corois-dio* non lo voi revochar, ma ben li darà tal corois9on che '1 vicinerà ben con la Signoria nosira, e9on che '1 vicinerà ben con la Signoria nosira, e eoninboendo lo leverà et li torà quel governo. Scrile cso Oralor, si provedi in Friul etc. perchè con-le cso Oralor, si provedi in Friul etc. perchè condusive non é remedio non vegni, e cussi li hadusive non é remedio non vegni, e cussi li ha dillo moosigiior di Qàievers. Scrive, eri zonse uno capilaoo vien di Chastiglìa. Riporla come la comunità di Burgos aspeta la rìsolution di quella Maestà e il rilomo dil loro nontio mandoe di qui |)er averla, e eome lo exercilo di lo \rmirante avia preso uno caitdio diiamato Villa Graodo 7 mia lontan da Me-itdio diiamato Villa Graodo 7 mia lontan da Meiiot de Rio Secho, qual é dil Contesta bele, che ha-iiot de Rio Secho, qual é dil Contesta bele, che haTe» rdkdlato, et come il campo di la Santa Zonta,Te» rdkdlato, et come il campo di la Santa Zonta, over di quelli populi, era li propinquo per far la zorBib: per il che esso Contestal)ele in Burgos aviaBib: per il che esso Contestal)ele in Burgos avia ddibemto veder di aver la Torre di Silex dove è la Baioa, el voleva andar ivi col campo a expugnarla ; et che si scaramuzava con li cavalli lizieri, i quali mio sta iDiltmctali . . . Questi si dubitavano di tal nmtfi mt non voria fosse fata, et manderà la raololion. Scrive, ha auto le letere per i capitani di Ifann eie El parlando col Gran canzelier, li ha ditto il He e Raina di Portogallo voler dar ajuto a la Cenrca Maestà e aver facto la monstra di le so* zentenrca Maestà e aver facto la monstra di le so* zente «t nandirie a li confini, et etiam è sta scrito al re d*lagallen, come lui Orator ha inleso per bona via, ridMendo V impresti ducati 100 milia per questo no bisogno, perche di quelli 1* imprestò prima e di qaerti lo farà cauto, pregandolo esso Re mandi uno la Spagna a notificar a quelle comunità, eh' è per Viivrh Cesarea Maestà se non ritorneno a soa obedieolia etc Scrive, il reverendissimo cardinal Ma-dieolia etc Scrive, il reverendissimo cardinal Mapatino eleclor di Y Imperio zonse mo* terzo zoniopatino eleclor di Y Imperio zonse mo* terzo zonio M iri in Vonnantia. La esarca Maestà li andò conlra. EHam loozerà il Treverense e li altri eleclori, quali Tengono per far la dieta. Scrive, Torator di Anglia k spaia letere al suo Re, et è spesso con la Cesarei Maestà in consulto.rei Maestà in consulto."
28,['Gradisca'],557,"DiAngUa^ dil Surian orntor nostro^ date a  Londra a dì 28 Navembrio. Come ricevete no-  stre letere con li sumari dil zonzer di Torator dil  Turco per ooorinnar la paxe, e la eletion fata di  l' oralor Uinio al dito Signor, et la letera drizata al  reverendissimo Cardenal, ringraliatoria dil bon oRcio  fato per la Signoria nostra. Unde andò dal prefato  Gardena!, e li comunicò dite nove. Disse, questo Si-  gnor ha anni :25, è di bona prudenlia, saria da temer  non fosse come il padre; poi 11 de la letera di la Si-  gnoria con parole acomodate. Quella lela, ringratiò  la Signoria offerendosi etc. Poi disse, aver il Papa  voi sguizari per la impresa di Ferara, et che il re di  Pranza, ni la Signoria nostra doveva soportar, ni  etiam el suo Re li piace per esser di nominati per  dita Maestà in la Itga et paxe con Pranza fala ; et che  l'ha scrito al Papa, con altre parole indicative la  mala contenteza di questo. Poi li disse, tien il re Cri-  stianissimo non vera in Italia, et che la Cesarea Ma-  jesià, fato le visite con il serenissimo re di Hongaria  el Polonia et lo illustrissimo Infante suo fradelo nel  qoal é mandata madama Anna sorela dil re di Hon-  garia, le qual viste sarano a meza Quaresema, an-  derà in Spagna per cessar quelli tumulti, e lasserà  vicario imperiai dito Infante, perché cussi é con-  tento il ducha di Saxooia al qual pareva convenisse  questo cargo. Poi disse, che *l conte Cristoforo ve-  niva in Friul al governo di quelli lochi mandato a  requisition dil cardenal Curzense ch'é suo cugnato,  zoé di Maran et Gradischa, che sono di la Signoria  nostra. "
29,['Gradisca'],584,"Di Udene, di sier Francesco Donado ti ca-  valier, luogotenente in la Patria, di 21. Come,  in execution di le teiere di la Signoria nostra, disse  al magniRco capitano cavalier di la Volpe, andasse  a stanziar in Cividal. Il qual rispose adderi oiolto  volentieri, et ha mandato a preparar le fttansie ; ma  voria le chiave di le porte in le man, qual lieo quel-  la comunità, /fem, ha dito a Cesare sao fradelo,  fazi venir in Udene alozar li 18 homeot d*»rme, et  (Hissl fari. Scrive di capi di siratioti a far ei aimilc.  Item, et cavalier di la Volpe li In dito li cavali in  Cividal noh fìi miHa, meglio saria Canti fonti. EI ba  mandalo uno suo a Postoyna loco dfl odate Cristo-  fbro per saper la sua venuta; el qual conte Cristoforo  non é ancora zonto, et se divulga verik eoa 100 ca-  vali todeschi, licei votìa lui menar corrati, ma to-  deschi non voleno eorvali, et lui li meacri e non  sarà altro. Scrive, in Maran, Gradischa et Gorida,  poleno esser da 1 SO in 200 l^nii, a lercha 30 ca*  vali di todescbi. "
30,"['Marano', 'FrìuliX']",496,"Dil ditto, di Ì7, in*. Scrive, zercha li 30  ducati il Philinger solicita, et volendo aver te lelcn  dite, par Soa Maestà intrasse nel Gonsejo e  gna ron nuMisignor di Qiievers el Gran  e altri, e intrato chiamono dentro el conte Crìstolb-  ro Frangipani, qual stato un pocho ussi fuora iboIIo  aliegro, e persone si al^rava con lui et pncijfme )  li foraussiti. La causa fu perchè fu ekto j'^pitMi*! ji  Maran e Gradiscila. Per il die, oognosceodo il ani  animo dil ditto conte Cristoforo verso h Signoria  nostra, pariò al Gran canzelier, dioeudo questa ck-  tion é routraria al voler di la Cesarea Maestà, qoal  voi ben convicinar con la Signoria nustn, dicendo  le raxon non si dovea mandar dito Conte, perchè si-  ria incitamento di guerra, e la Signoria manderi  zenle in Frìul, e cussi si principierà gariiuio. Lri  Gran canzelier disse non é da pariar, perche era sii  deliberà nel Gonsejo, perdiè lui ha pratica in qvrih  lochi, poi é benemerito per esser stato presoo ìm  questa terra, poi il Re spende mandando costui du-  cati 5000 mancho di quello spendeva ; e V Oralor ii^fse h Ccsaren Maestà non doveva vardar a l\ì ngno in lanta cossa; con altre parole sapientissìdite per lui Oralor. Hor ozi, dito Canzellier li hadite per lui Oralor. Hor ozi, dito Canzellier li ha ilio aver parlato al Re di quello; ma non c'è rimedio* non lo voi revochar, ma ben li darà tal corois-dio* non lo voi revochar, ma ben li darà tal corois9on che '1 vicinerà ben con la Signoria nosira, e9on che '1 vicinerà ben con la Signoria nosira, e eoninboendo lo leverà et li torà quel governo. Scrile cso Oralor, si provedi in Friul etc. perchè con-le cso Oralor, si provedi in Friul etc. perchè condusive non é remedio non vegni, e cussi li hadusive non é remedio non vegni, e cussi li ha dillo moosigiior di Qàievers. Scrive, eri zonse uno capilaoo vien di Chastiglìa. Riporla come la comunità di Burgos aspeta la rìsolution di quella Maestà e il rilomo dil loro nontio mandoe di qui |)er averla, e eome lo exercilo di lo \rmirante avia preso uno caitdio diiamato Villa Graodo 7 mia lontan da Me-itdio diiamato Villa Graodo 7 mia lontan da Meiiot de Rio Secho, qual é dil Contesta bele, che ha-iiot de Rio Secho, qual é dil Contesta bele, che haTe» rdkdlato, et come il campo di la Santa Zonta,Te» rdkdlato, et come il campo di la Santa Zonta, over di quelli populi, era li propinquo per far la zorBib: per il che esso Contestal)ele in Burgos aviaBib: per il che esso Contestal)ele in Burgos avia ddibemto veder di aver la Torre di Silex dove è la Baioa, el voleva andar ivi col campo a expugnarla ; et che si scaramuzava con li cavalli lizieri, i quali mio sta iDiltmctali . . . Questi si dubitavano di tal nmtfi mt non voria fosse fata, et manderà la raololion. Scrive, ha auto le letere per i capitani di Ifann eie El parlando col Gran canzelier, li ha ditto il He e Raina di Portogallo voler dar ajuto a la Cenrca Maestà e aver facto la monstra di le so* zentenrca Maestà e aver facto la monstra di le so* zente «t nandirie a li confini, et etiam è sta scrito al re d*lagallen, come lui Orator ha inleso per bona via, ridMendo V impresti ducati 100 milia per questo no bisogno, perche di quelli 1* imprestò prima e di qaerti lo farà cauto, pregandolo esso Re mandi uno la Spagna a notificar a quelle comunità, eh' è per Viivrh Cesarea Maestà se non ritorneno a soa obedieolia etc Scrive, il reverendissimo cardinal Ma-dieolia etc Scrive, il reverendissimo cardinal Mapatino eleclor di Y Imperio zonse mo* terzo zoniopatino eleclor di Y Imperio zonse mo* terzo zonio M iri in Vonnantia. La esarca Maestà li andò conlra. EHam loozerà il Treverense e li altri eleclori, quali Tengono per far la dieta. Scrive, Torator di Anglia k spaia letere al suo Re, et è spesso con la Cesarei Maestà in consulto.rei Maestà in consulto."
