,Place,Column No.,Paragraph
235,['Rialto'],630,"Noto. A dì 9, Sabado, bore 33, seguite uno caso  in questa tèrra in Rialto. Sier Marin Grimani qu. sier  Piero, di età di anni 76, non voi honori, é grandis-  simo ricbo, era misero e porta da On anno in qua  manege dugal, e tamen va spendendo e facendo il  suo pristino costume da misero: par che alcuni zen-  tilhomcni zoveni, videlicet sier Andrea Contarini qu.  sier Teodosio, sier Jacomo Badoer di sier Hironimo,  sier Benedeto Zane qu. sier Andrea, et sier Zuan  Zustignan qu. sier Lorenzo, lo scontrasse e li dices-  se : « Poltron, meli zoso quella vesta, tu non è degno  dì portarla, tu no é sta mai di Pregadi, > con altre  parole obrobriose, el lì treteno uno scovolo imbratà  adosso, et per quanto el dice, uno di loro li messe la  bocha in rechia dicendo : « Dame 10 ducati si non  ti tajeremo le manege ». Hor il ditto si andò a do-  ler al Doxe, et ozi li Soli a li Cai di X e deteno la  querela suplìcando fusse castigati questi tali; et li 378  Cai di X disseno non li parerla fusse suo officio, ta-  men volseno acetar la querela. "
236,['San Marco'],89,"Fu posto, per li Consieri, Cai di di XL e Savii,  suspender li debiti di sier Marco Duuado qu. sier  Donado debitor di la Signoria nostra per anni do  prosimi. Il qual ha passa 90 anni, é il più vechio di  Venelia zentilbomo, tamen vien a Consejo el va per  terra 4 volte al zomo a San Marco. Fu presa, ave  179, 3, 0. "
237,['San Marco'],177,"El di Candia, fo teiere di rectori, e prevedadar general Jusiinian, di 17 Avosto. Zerdudar general Jusiinian, di 17 Avosto. Zerdu quelle occorenlie et fabriche hanno principiato t far etc       177 19 . ji iB ÌJ9. Li OMtina in Quarantia crimioal To  expedìto 3 caso di quel .... Donio di Castel Fiud-  dio, fai condusse uno suo nepote Sol di suo fra-  dello a Ugiiago, e ivi lo amazò per aver lui tutta la  rolM; il qual fo cbiamato e bandito absente eoo ti\ja»  ei cdte soi floG siano privi di la dita roba. Et naviter  Ai fimo ... et condolo in questa terra, et cussi fu  mandarlo a exeeution di la leie, viddicet  m per Canal grando su uno soler Bora una  Goo a Santa Croie» poi per terra a eoa di ca-  Tmlio tirado fino a San Marco, e in meso le do Co-  ì»MMm m desoopado ei poi squartado eie. Ei cussi  Sttl>ado se farà la juslitia. Item, uno altro li sia cavi  oebio. "
238,['San Marco'],190,"Kafendo l'offiUo nostro sopra le Aque a (ar onlte execolioa importantissime, le qual rizerchano gm'iamma di danari, dovendose quelli Inzer per ■fai Tia che de angarie, ehtrovindose molte palate ne k qual se meleno patatieri et scrivani per cadauna pihta el quelli sta a meler a li ofHcii di Govemadorì el Gilbaveri jiro tempora come ì mancano, et però randerft parte: che per aatoritb di questo Consejo, lia proo che da poi h morie di cadian di palatieri el lenvanl predìtU, et etiam compile le expetative, W «bsDa ne fuM che l'offllio predllto sopri le aque de presenti per via de incanto over per qualunque  altro modo che sari deliberi de poter Iraser maior  quantità di danari, possi dar a chi più ofieriri le pt-  lade et scrivani prediti, con le condition ìnfrascripte,  che coloro le lorano per via de incanto over allra-  menle, quando quelli che li hanno venìrano a inan-  ellar, posino meler uno al ditto exerdlio de pala  n've scrivania, el notarle in nome di cui el vorà che 136 '  sia apio el idoneo a tal exercilio, el quelli possi gal-  deret usufruir per lutto il tempo de la vita sua;  e se i maDChasseno avanti cbe liavesseno quelle go-  duto anni 15, possino isoiberiedi et successori ^-  derii fino a compimento de dilli anni 15, dovendo  esser aprobati in Golzio per balole 15 di quello ad  mitiHf, con obtigalion al priocìpal condulor cbe vo-  lesse substituir in suo luogo, de emendar ogni eror  et eonlrafazjon qual fusse coraessa per essi subsU-  tuiti in suo luogo, intendaitdo sempre che quelli che  i meterano ad esercitar dHle palade, et scrivani,  sano epti et sufficienti a tal exerdtio et quello  exereili ben et l^lmente. Et simiUter li pràdilti  Savii sopra le aque, passino meler et depalar, con li  modi et condition soprascripti, li bastasi cussi al  Fonlego di San Marco come di Rialto da poi la morte  di qudli che de pretenti i godeuo, et da poi che  sarano compite tulle le expetalive, se alcuna ne  fusse; et questo medemo possino far de li mesu-  radori di formento et de sazadoh dil sai. Di parte  123, 72 di no. "
239,['San Marco'],257,"In questo lomo, poi vesporo, domino Marin Bi-  aiebeaaiy seodrenae, loe rethorica a Padoa, leié pn-  una ladion in raudìlorio a San Marco; elfo  * panona, perché voi esser eleclo per il Senato  a loer hi foco di Raphael Regia Fece prima una  ormtionay poi k;zé una oratione di Ciceron in versi.  t da saper, od intra Taniversario di la creatioo  dil Semnssimo Prìncipe nostro; compito anni ded-  iMwe, intra nel vigesimo. Soleva andar honorifiee  in cUesa di San Marco a hi messa, et di di oferta  ducati 3& d'oro venetnni; ma poi non poi caminar,  noQ va più a la messa, ma ben quella si dice, et li  manida h oflbrta, che prego Idio per molli anni an-  cori possi viver, per esser bon et juslo Prìncipe, im-  potante a eaminar, ma m fa portar in cariega, di età  àk aaai . . . compie a di ... . Novembrio prozimo,  ma onì maocha di Colegio, Consejo di X et Pregadi,  ti è sialo eUarn questi mexi a Gran Gonsqo.  }g4* ^ di 9. La melina, vene Torator di Ferara, do-  nino lacomo Tebaldo, per cosse partieubr; et fé*  huf una teiera, el Duca li scrive é contento br quel-  lo voi la Signoria zercha certo moro fuzilo de li etc  Di Bama, fo ìeUre^ di Fra$ufa^ et di MUan^  ì sumario éWò di solo. "
240,['San Marco'],271,"In questo giorno, in Tauditorio a San Marco, uno  Terentio Zancbo veneto, zovene di anni . . . . , va  vestito a la foresHiera, et studia ai Padoa in jure ci-  tili^ lexè una letion perchè voi esser balloUto in loco  dil suo preceptor Raphael Regio, zoé fece una ora-  tione molto latina, poi disse voleva lezer la oralion  di Gceron prò Mihne, demun intrò in la materia  de divinaliane^ dannando molto le condusion po-  ste per domino Uarin Bezichemi, leie retborica a  I%doa, qual etiam voi sta lelura, et era lì, instan-  dolo a risponder, ma non volse. Envi V orator dil  Cristianissimo re, doctori e altri docti, et k> Marin  Sanodo invidato vi andai. V'era etiam sier Batista  Egnatìo veneto suo preceptor, il qual non voi esser  bilMato per reputazion.  171 * Aé^S.lA nìatiiia. Fo san Magno primo episco-  po di Venetia, et si varda. Fo letere di Franaa^ di  l'Orator nostro^ da JRmsI, di ... e di l^pagna^  di BruxeUe. Dì quanto li fo scrito col Senato in la  risposta di investiture, con grandissima credenza,  dfùe • A X8 SepUwbre; le qual fo lete con li  Cai di X. EUam da Milan, fo teiere. Il somario  di tutte dirò di solo. "
241,['San Marco'],385,"In questo zomo in V auditorio a San Marco, do-  mino Biatteo Bonfin romano lezè pobliee, zoé fece il  principio di una oraUone. Vi fu assai patricii ; Io non  vi potei esser. Continuerà a lezer Toration di Tulio. "
242,['San Marco'],426,"L'anderi parte, che per auctorìti di questo Con-  sejo sia provisto, che de ctetero i aojelieri, oresi,  strazaruoli che toglionorobe a vender, venderigoli,  venderigole, sartori et tutti altri artesani di questa  nostra citi, quali si absenterano et fuzerano con ve-  stimenti et altri lavori che da zentilhomeni, citadini  nostri et altri li serano sti dati a far o vender, se  intendi sòUozazer a la leze, et incorer a la pena de  i ladri, et cussi de calerò si debia proveder cootra  di loro. La execution veramente di la presento parte  sia commessa a li Avogadori di Comun et Signori  dì note, quali habino a proceder centra i delinquenti  se haverano portato via robe per la valuta di du-  cati 30 in zoso, come li parerà, dummodo non in-  tervengi sangue, et da ducati 30 in suso come cen-  tra ladri famosi, sicoroe li pareri, meritar il delitto  loro. Et la presente parte non se intendi presa se la  non seri posta et presa nel nostro Mazor Consejo; la  qual poi sia publicada sopra le scale di San Marco e  Rialto a notizia di tutti. "
243,['San Marco'],466,"Fo publichà a San Marco et Rialto, da parte di  Cai dil Consejo di X, niun homo a femina in questa  terra si fazi maschara sotto pena etc. Item, non si  legni loci publici a baiar la sera come si fa, sotto  pena di danari e star in preson. "
244,['San Marco'],487,"Di Crema^ di sier Andrea Foscolo podesià  e eapiianiOj di 3^ Scrive, le Tabricbe ba Tato in  quella terra e li torioni. Et che ù posto San Marco, e  trova uno San Marco era in man di alcuni subdili di  Milan, valeva ducali 70, à auto per ducali 4 et lo ha  posto suso; et altre purlicularità zercha tal fabriclie. "
245,['San Marco'],487,"Fu posto, per li Savi loro, certa parte longa, che li  nodari di questa terra, si di Venetia, come imperiali,  siano revisti et esaminati per il Canzelier grando e  canzelieri inferiori, con molle clausole. Item, li no-  dari di offici di San Marco come di Rialto; e trovan-  doli non sufficienti siano cassi, e il deposito haves-  seno fato, siano fati creditori di la mela di quello a le  Cazude; e che diti nodari dagino uno candeloto da  lire 2 a San Marco el di di San Marco di Aprii, con  altre clausole. La qual parte era injusta. Volsi con-  tradir. Fata nolar per il Canzelier grando .... sier  Gasparo Malipiero andò suso, fo rimessa. "
246,['San Marco'],504,"È da saper, in questi zorni fu posto sopra i muri,  alti a San Marco el Rialto, excomunicati, sier Zuan  et sier GabrìeI Barozi qu. sier Jacomo, vestiti a ma-  nege a comedo con diavoli che li strangola, e questo  a requisition di lo episcopo di Treviso, per certe  senlentie fate a Roma, et par el Patriarca di Venecia  habi ordenato ditta excomunica in execulion di bre-  vi %'eouli da Roma. Undt li ditti andono io Colegio  a dolersi di questo, e fo mandato dal Palriardia a  dolersi, senza dir mente, bavia fato tal verigogna» d   (1) U carU 304 ' è biuKm. "
247,['San Marco'],559,"Fu posto, per li ditti, che cussi come li sindici di  'San Marco e di ftialto si feva per Quarantia criminal,  casA'de emtero il dittodffido dil sindaeha «a deputi  a ròfieio diCàtaveri, con quella isteesa autorità et  'eertedau90lelf^flllNirfe; la qual non se intendi  •presa^seh non sari tHam posta nel nostro Mazor  'GoB9qo;'fu presa. "
248,['San Marco'],569,"Fo poi posto la parte di mudar ToOcio di Sinici  di san Marco e di Rialto, che si feva in Quarantia  crittinal, a Toficio di Cataveri, presa a di 1 9 in Pre-  gadi. Et volendo Io Marin Sanudo contradirla per  molte raxon, fo uno sier Francesco Morexini qu.  sier Sgoatarin el qual corse in renga, ma non ha  toxSiDÌ é ascoltado; et visto questo, la Signoria ri-  messe di meter tal parte a uno altro Consejo. "
249,['San Marco'],606,"Noto. In questa oaatina in Quarantia criminal fo  fato (re Sinici di san Marco et 3 di Rialto, justa il so-  lito, siche la parte presa io Pregadi cbe '1 sindidii  sia de' Calaveri, non ha più vigor per non esser sii  presa in Gran Consejo. Li XL hanno voluto far li  Siodici per non perder la k>ro jurisditione. "
250,['San Marco'],606,"Fu publicbà su le scale di San Marco e di Rialto,  di ordine di Cai dil Consejo di X, che non si habbi a  far comedie in questa terra, jusla la parie presa 41  1508 nel dito Consejo di X. "
251,"['di Dorsoduro', 'Osso duro']",462,"Da poi disnar, fo Gran Consejo, et fo gran nu«  mero di zentilhomeni, et in scurtinio eramo numero  %8. Fu fato do Gonsierì di Venetia nuovi, zoédii se»  stier di Osso duro sier Zorzi Pixani dotor el cava*  lier, fo consiei^, vene per scuKinio et rimase in Gran  Consfjo sier Daniel Renier, fo savio del Conscio, di  ballote . . ; et dil seslier di Santa Croze rimase sier  Polo Donado. fo podestà a Padoa, qu. sier Piero e  e tutte le nove passoe. "
252,['Verona'],12,"Itefn, fu leto una letera di sier Lunardo  Emo podestà di Verona, di 1 5 T instante, come  il zorno di san Salvator, poco lontan di caxa soa,  fo assalta da alcuni stravestili Lunardo di Peiegriu  fo di domino Andrea dolor, et certi altri : per lauto  fu posto per li Consieri dar facultà al predito Podesih di far prodamar chi quelli acuseri, siche per la sua acusa si habbi la venti, (aja L. . . e si un compagno accaserà Taltro sia nsoUo el habbi la taja ; epagno accaserà Taltro sia nsoUo el habbi la taja ; e inleso chi è slati, li possi metter in bando di terre e lochi etc. e di questa citiV con taja vivi L. 500 et morti L 300, e i lóro beni siano oonfischati in camera. Ave : 12*2, 3.mera. Ave : 12*2, 3. 5 * Nola. In le ìetere di Rùina, di V Oraior nostro è: come comunichoe al Papa le bone nove di Tarmada turchesca suspesa etc. qual non le potè comuni-da turchesca suspesa etc. qual non le potè comunichar avanti perchè il di di san Zuanne il Papa dissechar avanti perchè il di di san Zuanne il Papa disse messa pontificai, solo quel zomo di 35. Soa Santità ave mollo grato intender questo, et vedendolo di buona vogKa, TOrator instò la revocalion dil breve fato per li frati di Corizola. Soa Beatitudine disse :"
253,['Verona'],32,"Fo scrilo a i reclori di Verona, dagi ducati 30 a  sier Piero Boidù per reparation di arzeri di TAdexe,  aziò fazi far provisioo a le inoudatioo eie. "
254,['Verona'],35,"Do Gastehni in Castel vecchio di Verona, é al pre-  sente uno solo, sier Batista Grili. "
255,['Verona'],35,"Castelan a San Piero di Verona, é Macon da Como  contestatele. "
256,['Verona'],35,"GKteho a L^nago, è Zoan Batista di Zoan Malo con  fanti ì% si paga a Verona. "
257,['Verona'],35,"Capitano di la Gtadela di Verona, fo dato per à  Coosejo di X a missier Lnoardo di Grassi, qual  li fo dato da poi ducati 200 di provision di beni  de* ribelli. "
258,['Verona'],65,"Fo scrilo ai rectori di Verona, dagino danari di  qvella Camera per spese a sier Valerio Marzelo sa-  vio a Terra ferma, vien in Colognese a far le mostre  de le zenle d'arme, qual si farà Meroore a di primo  Avvio a Cotogna. "
259,['Verona'],75,"47 Nolo. Sier Valerio Manelo savio a Terra iènua  partite a A 38 Sabado da sera per Padoa, per an-  dar a br le monstre a Cotogna, qual si lari Ueroore  a di primo Agosto, et lo seritu al Govemador Mie-  ni a Verona che si voy trovar. "
260,['Verona'],75,"È da saper, bavendo el reverendo episcopo di  Trento mandato a dimandar, per sue letere, irata dil  veronese di sten 400 biave e cara 40 di vin, a dì  ^9 di questo in Golegio di le biave, con li Gai di X,  gè fo concessa dita trata di biave, ei scritoli letere  al dito Episcopo in bona forma, come li baveano  cooeessa h trata per Tamor li portemo el obser-  vantia a la Maestà Cesarea. "
261,['Verona'],95,"Di Verona^ fo teiere di sier Lunardo Emo  podestà, e sier Piero liarseUo capitano. Come,  hessendo passado per il Lago il conte di Cariati, vien  di Napoli, >*a in Alemagna a trovar la Cesarea Mae-  stà, e scrive coloquii auli con Jacomo Barttaro capi-  tano dil Lago, ut in litteris, quali sono de impor-  ttolia. Item, che alcuni veronesi, nominati in le te-  iere, DOD però persone da conto, é venuti a trovar  dito Conte con farii ogni dimonslrazioo di honor, il  quii Conte fo govemador di Verona per la Cesarea  Maestà. La qual letera fo leta con . . . . "
262,['Verona'],118,"Fo lelo la investitura fece Tlmperador Sigismon-  do a la Signorìa, Doxe mìssier Francesco Foscari dil  1437, essendo a Soa Maestà orator nostro sier Mar-  co Dandolo el cavalier; qual é mollo longa, ma non  investite però di Verona, el ho la copia. "
263,['Verona'],135,"Da poi disnar, fo Consejo di X con Zonta. Et expedileno quel Pompeo Triulzi, el V altro absente, epedileno quel Pompeo Triulzi, el V altro absente, e la condanason fo publicata la ntatina, viékUcet che Antonio Montan nnilaoese, abseole, per haver prodi-  loriaiuenle ferilo in Verona domino Hironimo Con-  corezo ciladin de li, sia in perpetuo bandito di Ve-  iietia e dil deslreto e terre e lochi da parte da terra,  e si 'I conlrarani e preso sarà, li sia lajà la man  destra in mczo le do Colone e sia messo al bando, e  poi contrafacendo, siali tajà Taltra man, con taja chi  prenderà, lire 600 di pizoli. Itetn, Pompeo Triulzi  consentienle di tal delieto, sia in perpetuo bandito di  Verona e veronese, e mia 15 di confini, e si 1 con-  Irafarà, star debi anni do in preson serado e sia ri-  manda al bando, con taja lire ^000 a chi 1 prenderà,  et el ditto sia casso di stipendi! nostri. "
264,['Verona'],143,"Fu posto, per li ditti, non era -sier Francesco  Bernardo: atento die tutte le rol)e vien di Fiandra,  Alemagna e altri lochi, capitano a Verona e per via  di Hostia o?er di la Polesela vanno a le fiere soto  vento e altri lochi alieni, però sia preso, che tutte  saize, tapezarìe, tele, pani e tutte altre robe capita-  no a Verona, si de Ponente, come di terra todesca e  ogni altro loco, prima pagi li dadi consueti a Vero-  na, poi fazi le bolete per transito qui e non per al-  trove; dove zonte in doana di terra, siano poste in  uno magazen separado e pagi, oltra qudlo é solito  pagarse in le terre nostre, ducati uno e mezo per  soma di peso lire 500 a la sotil, ne si possi aprir le  baie si non per venderie de qui, e si tolesseno altro  camin per non andar a le fiere sotto vento, possino  le ditte mercadantie esser tolte per contrabando.  liem, il dazio posto a le dite a la Polesela over a It  Frata, per parte presa a di ^8 Noveml>rìo passado,  sia revocbato. Item, di qui pagi la miti di le spese,  ut in parte: 146, 18,^.  93 A di 39. ¥o san Zuane D^hdo. Fo Col^ di  le biave. Et fu preso certe parte et ordeni, atento  non vico rormenti di Ravetia qui, conoe prima so-  leva, perché li merchadanti vanno a comprarti de  R, ei li incanevano, et poi li trazeno per le terre  nostre, però sia preso che de attero alcun subdilo  nostro non possi far tal comprede per lassar li for-  menti de B, ma ben quelli adretura forti condur in  questa terra, soto pena etc., nt in parte. La qual  fo publicata in corte di Palazo a di ultimo ditto. "
265,['Verona'],144,"Da poi disnar, fo Consejo di X con Zonfa. Epri* 9  ma semplice. Et expedileno do, rideiieet Fìraneoco  da san Zuan di la Rogna fo famefo dil contesiiUe  dil Podestà di Verona, absente ma Icgil upam eal e  dtado, per aver roto e fato fozer da le  Verona Alexandro qu. Antonio ìfootan  retenuto a Verona per caso importante: che 1 diio  sia bandito di Venetia e dil destreto in perpeteo, •  di tutte terre e lochi nostri da terra, e rompeodo  stb uno anno in preson Forte e rimanda ti bmdQ^  e rompendo la seconda volta, li sia tajà ona nm  in mezo le do Cofone, con taja chi quello proMkri  L ÌOOO, ut in parte. "
266,['Verona'],148,"Fo scrito al Capitano di Verona e Gohtanl leoe-  ral, hessendo parIHi di Padoa senza KeenlHi Znn  Francapan et Jacomo dal Capello dì Verona lioaìDi  d'arme dil conte Mercurio, però volemo giaUm i  debbi cassar di dita compagnia. "
267,['Verona'],148,"< Uno Bernardo Timone Amardo Nigrìsole ile- 9  rarese, Jacomo barba dil dito Bernardo, et Anlooio  fam^io, banditi di Ferara et Mantoa per ImMori  et bari, se sono reduti ad habitar in Are, el feoe wlo  domino Federico Henrieo de Riperia manhese di  Ttelfa per andar in peregrinazo con boaww 14,  parte di qual cavalchavano continuo con Ini el |arle  andavano inanzi, perchè *1 ditto Marcbexe non volet  esser conosuto, venendo da Verona per andar -a  Manloa, a di 4 over 5 di de... 1519, uno migUo Ioq-  tan di Verona, trovoeeldiio Bernardo TimoD vestilo  da merchadante sopra uno cavalo biancho beo in  ordine, fenzè esser napolitano, parlando napoMano  et spagnolo, et acompagnose con ditto Marcbexe ri-  sonando varie cosse. Et loquace ei mollo iaeeUv d  rasonando che cosa nova li era, lui disse cbe 1 Vmk-  tefice volea ogni modo far bona amidtia col redi  Spagna et altre parole. El cussi procedendo, iacoo-  trorono in uno stafeta a piedi vestilo da eorvier» el  qual correa di tutla corsa, e ditto Bernardo fase bak  admiralìon di questo, et lassatolo passar nn poeo ol-  irà, da poi lo chiamò, e il ditto Marcbexe Y al feee  chiamar da li soi cbe 1 si aflermasse, et dicesae quello  era di novo. £1 qual rispose : signor, io ve dico  el Pontefice mandava uno aoibasador al re di SpagiM, e II mandiiva a donar un carbouo di valuta di gran qoanUUi di danari ; el qual carbon é stato perso in una stalla « Bologna^ e colui che T ha trovato s*è fugalo» e dixe li contrasegni de quel tal che 'I dicea cheJiavea trovato el carboncok) et portato via; et ohe 1 Poot^ce havia spaiato piti starete per inquerir di questo tal ; et che Soa Santiti voleva che chirir di questo tal ; et che Soa Santiti voleva che chi Tivea (osse ritenuto né offeso perché la zogiia non perdesse la sua virtù, la qual dicea havea in se gran virtute ; ma che tanto quanto si poteva acordar con lai che 1 havea, tanto se li dovesse dar, che Sua Santità li dark quatro volte piiL Da poi le qual parole,tità li dark quatro volte piiL Da poi le qual parole, dito eorier sequite il suo viaggio. Da poi circha un flaigiio, seontrorono una altra stapheta a cavalo de cofsa, el qual replichò questo instesso, dagando una curia dil Pontefice con le bolle in la qual erano divani premii a quello tal recuperava ditta zogiia ; lavani premii a quello tal recuperava ditta zogiia ; la 97 * qaal kssò al ditto Bernardo, e dicea averne assai simile da lassar in qua et là. E procedendo circha do Biglia, vene a la traversa per alcune biave uno a piedi tutto smarido, scolorito et timido, el qual procedo lutto tremando per la strada, et a li s^ni ha-cedo lutto tremando per la strada, et a li s^ni havaano date le starete, era qaello die havea la zogiia.vaano date le starete, era qaello die havea la zogiia. Et Bernardo lo mostrò al Marchese, et conduseno esser quello» et li andorono incontra, et foli fato paura ; ^ da poi diverse cose, fenzando aver paura etra ; ^ da poi diverse cose, fenzando aver paura et demandando la vita» disse haver la zogiia, et se cavoe di peto una cassetina de cuojo streta con una chiave, la qual aperta, ditto Bernardo la aperee et un podio la moostrà et poi la serrò dita cassela, facendo una akgresa grande, et cussi tutti si alegrorono. Immediate, dito Bernardo messe man a la borsa e li detediate, dito Bernardo messe man a la borsa e li dete ducati 10 et uno anello di valuta di ducati 10» e non oontentaodoee dito trufador, el Marahese predito li date duo^ 340 et una capa di pano, e perché Fandame via e fusse securo, el ditto Marchexe volsedame via e fusse securo, el ditto Marchexe volse burlo aeompagnar da alcuni di soi. £1 ditto Bernardo disse: € Lassate far a me, che io so el paese,nardo disse: € Lassate far a me, che io so el paese, lo aeompagoerò in loco securo, cavalcate avanti che io Ti aggiuogerò > et cosi tolse in gropa quello tale el andorono in malora. Unde poi ditto Marchese a di 18 Oottobre 1519 dete querela a la Avogaria di oomun pregando esser sufragato> et a di 17 Novembrio io Quarantia criminal fu preso che '1 dito Ber*brio io Quarantia criminal fu preso che '1 dito Ber* nardo ISoum^ preso in Are et mandato di qui a le prexoo, sia ben retennto, coiegìato etc.: 36, 1, 1. Ei il Golegio toehò a sier Alvise Mocenigo el cavaliar, sier Nieolò Bernardo coosieri, sier Bernardoliar, sier Nieolò Bernardo coosieri, sier Bernardo Diodo eao di XL, sier Francesco Morexini avogador di Comun, sier Hironimo Tiepolo et sier Anto-dor di Comun, sier Hironimo Tiepolo et sier Antonio Michiel Signori di notte.nio Michiel Signori di notte. L* habito avia dito sier Bernardo quando fu trovato dal Marchese, era quello vestito di negro convato dal Marchese, era quello vestito di negro con uno sajo negro, cabse bianche con stivali con una spada da do man a lai deslroj in testa una barella n^ra con meza volta, con un pocho di barba negra, et havea su V arzou davanti un feltron bianchogra, et havea su V arzou davanti un feltron biancho et uno capello con una bolzeta di cuoro, et era grande di statura, membruto, et distante zercha uno miglio di Villafranca segui il caso. L*altro avea un sajon negro, una bareta rosa, uno capei biancho, una calza biancha, di eia d'anni ^5."
268,['Verona'],155,"Fu poste, per li diti, atento fosse preso a di 3 di  Avosto che li rectori dovesseno meter a T incanto  li beni di debitori di la Signoria nostra, e non tro-  vando òhi quelli comprasse li metesseno in la Si-  gnoria per k stima con il quarto mancho; e perché  vien fate le stime molto ingorde adeo poi messi  ditti beni a l' incanto non si trova comprador a  quelli precii, per tanto la dieta parte sia corecta, vi-  délieet che ditti beni siano posti in tenuta senza  altra stima, et la Signoria compri sicome eadaun  altro, et siano incanladi li beni per la Signoria no-  stra a beneficio e maleficio di essi debitori, ut in  parte. 149, 37, ^  104 Fu posto, per li Savii, atento fusse dà provision,  a di 4 Octubrio, zoé stipendio, al conte Damian Co*  ootia fo genero del conte Coxule, et conte Gargat  fo nipote dil dito Coxule, con cavali 10 di confati  per cadauno, i quali é venuti a U servici di la Signo-  ria nostra e fato la mostra a Zara, per tanto li sia  deputa la camera di Verona, e di danari di la limitation siano pagati deputati a le gente d*aniie a ducati 8 per paga, page Sai' anno, e a li oomti di Ucati 8 per paga, page Sai' anno, e a li oomti di U compagnia: 165, 5, 8."
269,['Verona'],157,"Etel dito todesco in questa matina fo in Coiaio,  et ha presentato questa letera di TOrator nostro e  di la Cesarea Maestà, e richiese li 20 milia scudi. Il  Principe li fece grata eiera, dicendo Tanno passato  li fo (Ù li scudi 20 milia, iamen di le cosse resta a  expedir di ditti capitoli di le trieve nulla fu concluso  a Verona, et saria l)on iusse ultimate per poter vi-  ver in quiete. "
