,Place,Column No.,Paragraph
88,"['Fratta', 'Polesine', 'la']",143,"EI SerenissinK) fu a Consejo.  Et da poi Consqo, fo gran vento, adeo una nave  de bote . . . carga di valonie e altro, di sier Gaspa-  ro Nidal qu. sier Nadal, hessendo ^ra Portosecco  si averse et andò a fondi. "
89,"['Fratta', 'Polesine', 'la']",143,"A dì 30, Ia matina non fo alcuna letera da  conto. "
90,"['Fratta', 'Polesine', 'la']",143,"Fo scrito, per Colegio, al provedador d* Ampbo  sier Josto Guoro, come, inteso il bon ofBtio e micini  beo d9 capitano di Stenech, e li conti dil Castel Roman, per tanto bavemo deliberato mandarli par Augustìn de Parma contestabile in Ampbo, è veoolo de qui, uno presente di alcune cosse, videUeei veri, cere et specie, per tanlo lo invii etc. Et replicfaalo^ havendo inteso da li homini di Bagolin le m ol c a fe fanno quelli conti di Lodron, volemo non lassi |ias* sar vituane vadino a L.odron, né alcuni di loro di Lodron per transito per dita rocha di Ampho."
91,"['veneziano', 'Gambarare']",194,"Da poi disnar, fo Consqo di X con la Zonta, et  sempliee. Et fono sopra li vilani di le Gambarare et   13 expediteno . . . absenti, videlieet b«iidizali come di solo scriverò; et li presenli non poteno expedir. É processo di 100 carie, rimesso a uno altro Conscio. Il Doxe vi fu, et vene zoso il Coosejo a la seconda campana."
92,"['Gambarare', 'veneziano']",194,"Da poi disnar, fo Consqo di X con la Zonta, et  sempliee. Et fono sopra li vilani di le Gambarare et   13 expediteno . . . absenti, videlieet b«iidizali come di solo scriverò; et li presenli non poteno expedir. É processo di 100 carie, rimesso a uno altro Conscio. Il Doxe vi fu, et vene zoso il Coosejo a la seconda campana."
93,['Gradisca'],308,"Dil dito, ivi a dì uUimo. Eri fo a palazo con il  nontio pontificio per esser San Mìchiel, per andar a  la messa con la Cesarea Maestà, credendo, per esser  di Tordine, avesse Tabito come é il consueto portar  in tal zomo. Quella non havia, scusandosi li stÀ averlo  lassato a Holines. Scrive, il Gran canzdier averli par-  lato di ordine di lo illustrissimo Chievers, come é sti  con quelli dil Coosejo di Inspruch, a li quali disseno  la causa non hanno mandato li agenti in Friul per  tratar le differente aziò si vivi li subditi in pace.  Quelli di Inspruch risposeno la colpa e dì la Signorìa;  averli scrito avisi il zorno si dieno trovar, e mai  hanno auto risposta, unde TOrator disse questo non  poi esser, perché Ve uno anno lui solidta tal andata.  Disse poi esser le letere sia sta ordinate per il Con-  sejo di Inspruch, ma non mandate. Poi disse, per  questo la Signoria non dia restar di pagar li scudi  30 milia per le trieve, perché hanno visto li capitoli,  non che si mandi a veder ste differentie, ma si Irati  dil quarto di beni di rebeli, el havendo il Re Ma-  nin e Gradisca, quelle ville dia esser sue. L' Orator  li rispose é falso, ut in litteris^ e se dia restituir i  beni di subdìli, e lui Gran canzelier, volendo parlar  in jure, concluse in Aquisgrana sarà altri dil ditto  Consejo di Ispruch e si vederà. Poi disse saria boa  la Signoria mandi a tratar di qui quelle materie che  si manda de li, e non si manchi di dar li 20 mila  scudi. L' Orator rispose si farà come fa a Verona,  che fu dato li danari di scudi 30 milia, et nulla Tu  fato. Rispose il Re voi il tutto, e in quello si poterano  componer, si concluderà: se resterà differentie, il  Cristianissimo re sarà judice. E questo disse, perchè  r Orator disse non e onesto vui siate judici e parie.  Scrive, monsignor di Chievers ha concluso et é sta  posto in possesso lo episcopo dì liege di F abatia, "
94,['Gradisca'],496,"Dil ditto, di Ì7, in*. Scrive, zercha li 30  ducati il Philinger solicita, et volendo aver te lelcn  dite, par Soa Maestà intrasse nel Gonsejo e  gna ron nuMisignor di Qiievers el Gran  e altri, e intrato chiamono dentro el conte Crìstolb-  ro Frangipani, qual stato un pocho ussi fuora iboIIo  aliegro, e persone si al^rava con lui et pncijfme )  li foraussiti. La causa fu perchè fu ekto j'^pitMi*! ji  Maran e Gradiscila. Per il die, oognosceodo il ani  animo dil ditto conte Cristoforo verso h Signoria  nostra, pariò al Gran canzelier, dioeudo questa ck-  tion é routraria al voler di la Cesarea Maestà, qoal  voi ben convicinar con la Signoria nustn, dicendo  le raxon non si dovea mandar dito Conte, perchè si-  ria incitamento di guerra, e la Signoria manderi  zenle in Frìul, e cussi si principierà gariiuio. Lri  Gran canzelier disse non é da pariar, perche era sii  deliberà nel Gonsejo, perdiè lui ha pratica in qvrih  lochi, poi é benemerito per esser stato presoo ìm  questa terra, poi il Re spende mandando costui du-  cati 5000 mancho di quello spendeva ; e V Oralor ii^fse h Ccsaren Maestà non doveva vardar a l\ì ngno in lanta cossa; con altre parole sapientissìdite per lui Oralor. Hor ozi, dito Canzellier li hadite per lui Oralor. Hor ozi, dito Canzellier li ha ilio aver parlato al Re di quello; ma non c'è rimedio* non lo voi revochar, ma ben li darà tal corois-dio* non lo voi revochar, ma ben li darà tal corois9on che '1 vicinerà ben con la Signoria nosira, e9on che '1 vicinerà ben con la Signoria nosira, e eoninboendo lo leverà et li torà quel governo. Scrile cso Oralor, si provedi in Friul etc. perchè con-le cso Oralor, si provedi in Friul etc. perchè condusive non é remedio non vegni, e cussi li hadusive non é remedio non vegni, e cussi li ha dillo moosigiior di Qàievers. Scrive, eri zonse uno capilaoo vien di Chastiglìa. Riporla come la comunità di Burgos aspeta la rìsolution di quella Maestà e il rilomo dil loro nontio mandoe di qui |)er averla, e eome lo exercilo di lo \rmirante avia preso uno caitdio diiamato Villa Graodo 7 mia lontan da Me-itdio diiamato Villa Graodo 7 mia lontan da Meiiot de Rio Secho, qual é dil Contesta bele, che ha-iiot de Rio Secho, qual é dil Contesta bele, che haTe» rdkdlato, et come il campo di la Santa Zonta,Te» rdkdlato, et come il campo di la Santa Zonta, over di quelli populi, era li propinquo per far la zorBib: per il che esso Contestal)ele in Burgos aviaBib: per il che esso Contestal)ele in Burgos avia ddibemto veder di aver la Torre di Silex dove è la Baioa, el voleva andar ivi col campo a expugnarla ; et che si scaramuzava con li cavalli lizieri, i quali mio sta iDiltmctali . . . Questi si dubitavano di tal nmtfi mt non voria fosse fata, et manderà la raololion. Scrive, ha auto le letere per i capitani di Ifann eie El parlando col Gran canzelier, li ha ditto il He e Raina di Portogallo voler dar ajuto a la Cenrca Maestà e aver facto la monstra di le so* zentenrca Maestà e aver facto la monstra di le so* zente «t nandirie a li confini, et etiam è sta scrito al re d*lagallen, come lui Orator ha inleso per bona via, ridMendo V impresti ducati 100 milia per questo no bisogno, perche di quelli 1* imprestò prima e di qaerti lo farà cauto, pregandolo esso Re mandi uno la Spagna a notificar a quelle comunità, eh' è per Viivrh Cesarea Maestà se non ritorneno a soa obedieolia etc Scrive, il reverendissimo cardinal Ma-dieolia etc Scrive, il reverendissimo cardinal Mapatino eleclor di Y Imperio zonse mo* terzo zoniopatino eleclor di Y Imperio zonse mo* terzo zonio M iri in Vonnantia. La esarca Maestà li andò conlra. EHam loozerà il Treverense e li altri eleclori, quali Tengono per far la dieta. Scrive, Torator di Anglia k spaia letere al suo Re, et è spesso con la Cesarei Maestà in consulto.rei Maestà in consulto."
95,['Gradisca'],557,"DiAngUa^ dil Surian orntor nostro^ date a  Londra a dì 28 Navembrio. Come ricevete no-  stre letere con li sumari dil zonzer di Torator dil  Turco per ooorinnar la paxe, e la eletion fata di  l' oralor Uinio al dito Signor, et la letera drizata al  reverendissimo Cardenal, ringraliatoria dil bon oRcio  fato per la Signoria nostra. Unde andò dal prefato  Gardena!, e li comunicò dite nove. Disse, questo Si-  gnor ha anni :25, è di bona prudenlia, saria da temer  non fosse come il padre; poi 11 de la letera di la Si-  gnoria con parole acomodate. Quella lela, ringratiò  la Signoria offerendosi etc. Poi disse, aver il Papa  voi sguizari per la impresa di Ferara, et che il re di  Pranza, ni la Signoria nostra doveva soportar, ni  etiam el suo Re li piace per esser di nominati per  dita Maestà in la Itga et paxe con Pranza fala ; et che  l'ha scrito al Papa, con altre parole indicative la  mala contenteza di questo. Poi li disse, tien il re Cri-  stianissimo non vera in Italia, et che la Cesarea Ma-  jesià, fato le visite con il serenissimo re di Hongaria  el Polonia et lo illustrissimo Infante suo fradelo nel  qoal é mandata madama Anna sorela dil re di Hon-  garia, le qual viste sarano a meza Quaresema, an-  derà in Spagna per cessar quelli tumulti, e lasserà  vicario imperiai dito Infante, perché cussi é con-  tento il ducha di Saxooia al qual pareva convenisse  questo cargo. Poi disse, che *l conte Cristoforo ve-  niva in Friul al governo di quelli lochi mandato a  requisition dil cardenal Curzense ch'é suo cugnato,  zoé di Maran et Gradischa, che sono di la Signoria  nostra. "
96,['Gradisca'],584,"Di Udene, di sier Francesco Donado ti ca-  valier, luogotenente in la Patria, di 21. Come,  in execution di le teiere di la Signoria nostra, disse  al magniRco capitano cavalier di la Volpe, andasse  a stanziar in Cividal. Il qual rispose adderi oiolto  volentieri, et ha mandato a preparar le fttansie ; ma  voria le chiave di le porte in le man, qual lieo quel-  la comunità, /fem, ha dito a Cesare sao fradelo,  fazi venir in Udene alozar li 18 homeot d*»rme, et  (Hissl fari. Scrive di capi di siratioti a far ei aimilc.  Item, et cavalier di la Volpe li In dito li cavali in  Cividal noh fìi miHa, meglio saria Canti fonti. EI ba  mandalo uno suo a Postoyna loco dfl odate Cristo-  fbro per saper la sua venuta; el qual conte Cristoforo  non é ancora zonto, et se divulga verik eoa 100 ca-  vali todeschi, licei votìa lui menar corrati, ma to-  deschi non voleno eorvali, et lui li meacri e non  sarà altro. Scrive, in Maran, Gradischa et Gorida,  poleno esser da 1 SO in 200 l^nii, a lercha 30 ca*  vali di todescbi. "
97,['Italia'],30,"Di Franga, di sier Zwin Badoer dotor, el cavalier, e sier Antonio Justinian dolor, oraturi nostri, date a dì 21 Zugno. Come, havendoturi nostri, date a dì 21 Zugno. Come, havendo posto ordine, quelli reali, di esser insieme, et sempre die i andavano si trazeva prima artelarie, quelpre die i andavano si trazeva prima artelarie, quel era segno che li Re si venivano a scontrar, hor a di . . . di questo, la matina per tempo, il re Christianissimo si levò con dieci di soi, el andò Ano a Gui-nissimo si levò con dieci di soi, el andò Ano a Guioes al castelo, che il Re non era partito. Qual, in-oes al castelo, che il Re non era partito. Qual, inteso questo, subito li vene contra abrazandosi in-teso questo, subito li vene contra abrazandosi insieme, e il re dMngaltera li de' uno colar aveva alsieme, e il re dMngaltera li de' uno colar aveva al collo dì zoje e perle di gran valuta. Et stato alquanto cussi, il re di Franza tornò ad Ardre; ma primato cussi, il re di Franza tornò ad Ardre; ma prima il re Christianissimo donò a rincontro al re dMngaltera le soe manille d*oro adornate di zoje di grangaltera le soe manille d*oro adornate di zoje di gran valuta. Et poi tornato, li parse il don non esser equivalente al presente auto, e la ChrisUanissimaquivalente al presente auto, e la ChrisUanissima Maestà noandò a donar al re dMngaltera sei corsieri di gran precio et bellissimi. Et poi, T altra matina, il re d' Ingallera vene a trovar il re Christianissimo ad Ardres, che ancora non era levato de leto; siclté tra loro sono in tanta amicilia el benevolentia, che pid dir non si potria. Si lien certissimo che sarano in perfeta paxe tra loro. Scriveno, il re Christianissimo a di ^5^ leverà per Paris el il Re anglico si dia abocbar iterwn con la Cesarea Maestà eh* è a Bru-bocbar iterwn con la Cesarea Maestà eh* è a Bruxele, el si dieno trovar a Gravelin, loco 4 mia lon-xele, el si dieno trovar a Gravelin, loco 4 mia lontan di Cales. Scrivenotan di Cales. Scriveno Di sier Antonio Surian dolor et cavalier,  orator nostro apresso il re di Anglia, date a . .  , , ,ad\20. Scrive in conformila ut supra, che 't  reverendissimo Eboracense, a di . . . volse dir mes-  sa, et poi fece uno banchetto dìgnissimo a molti si-  gnori francesi el anglici, el erano li 3 oratori nostri  el quelli dil Papa e dil re Christianissimo, et man-  zono tutto in oro. Et parlando, disse di Tamor di  questi reali, et che *l re Calholico non bisogna aspiri  più altro in Italia, né dar fastidio al re Christianissi-  mo né a la Signoria nostra, dicendo gran ben de la  Signoria nostra ut in litteris. Scrive de lo abocha-  mento iterum si farà con la Cesarea Maestà el quél  Serenissimo re di Anglia a .... u^ supra dictum  65^; et come hanno terminato far fabrichar dove  questi Re hanno parlato una chiesia, che si chiamerà  Santa Maria dil parlamento, et dotarla tra loro  reali di preti che la debano oficiar per memoria  eterna.     Sumario di letere di sier Zuan Badoer dotor 17  et cavalier, et sier Antonio Justinian dotor  oratori nostri in Franga, date a dì 21 Zu-  gno 1520. "
98,['Italia'],95,"Scrìve, come volemio far certo baocheto in Ca-  les a questo re Catholico, sopravene lanla fortuna  che porlo via le canevaze dil coverto eie, adeo si  eoQvene farlo in certa caxa picola eie Scrìve, quella  Maestà Cesarea, essendoli portato ila una dona la sua  imagine, li donò una cadena di scudi 500.  61 Scrìve, ha inteso, per bona via, il Re averli dito  che Soa Cesarea Maestà non si pensi venir in Italia  a tuor la corona de Tlmperìo, armato, percliè li farà  dispiacere, perchè voi esser unito con suo fradello  re ChrìstianisBimo, et ditto Re li ha dato certa scrì-  tura, qual é sia mandata in Pranza dal Re a veder  se ré coolenlo. Scrìve coloquii auli col cardinal  Eboracense, qual dice non è da dubitar il Re vengi  armato ut supra ; e li ha tochà una parola, aspetta  U tapedi eie. "
99,['Italia'],100,"A dì 11 Avosio. La matina, vene in Colegio E  domino Marin Bicichemi scodrense, homo dodo in  humanità, leze rethorica a Padoa, et ha composto  opere, e desidera haver la lectiira di humanità in  questa terra, in loco di Raphael Regio é nnorto, a al  qual pre* Baptista Egnatio pretende, ina non vuol  esser balotado con alcun, et disse d voleva meler  1^ condusion, le qual sarano qui a\*anti poste, con  questo si Tera rinto non voleva altro in premio che  non metersi a la prova di tal lectura ; ma \inoendo  pre* Batista e altri, voleva poter esser balotado in-  sieme nd Senato, et mo sier Bernardo Capdlo qu.  sier Francesco el caralier discepulo di P Egnatio,  disse che non era da meler queste cosse, perchè chi  li dimandasse qual fo avanti la galhia o d vuoto non  si sa risponder, ne quando Enea smontò in Italia  qual pe' messe prima etc. adeo fé' rider il Col^jio.  Et sier Francesco Bragadin savio dil Consejo, qnal  favoriza pre' Batista, disse non era da dispular m  rethorica, ma cadaun lezesse per alquanti zomi. Esso  domino Marin disse die la retliorica é tutb dispn-  tation e il loicho d philosolb non liavendo rethorica  non sa disputar, come disse Zenon etc Et voleva  lenir la condusion, eUam lezer una letiou a caso  si aprisse le oralion di Tufio, et fo ditto è bon si  studii la Idion; disse: € lo li darò una letion a lecer  di dite oration, e pre* Batista me ne dagi un'altra a  lezer a mi », et cussi il Doxe disse mdesse le con-  dusion et lezese la Idioti.   Da poi disnar, fo Colegio di la Signoria, non vene "
100,['Italia'],111,"A dì 13. La matina, fo letere di sier France-  sco Corner el cavalier aratar nostro apresso la  Cesarea Maestà^ venule per la via di Milao, di 17  et 28 Lujo, date a Brugia. Scrive V entrata li de  li Re con grandissima pompa, et che quelli li jurono  fedeltà, et cussi fevano le altre citi circumvicioe,  stante che venivano signori di Germania a trovar  Soa Maestà ; la qual per di 10 OcUibrio saria in  Aquisgrana per incoronarsi Et che, zercha il suo  venir in Italia, par non sia sta concluso nulla si *l dia  venir pacifico, overo si se li mandi la corona dal  Papa, per aver posto la cossa a terminar, pariato  harà a li Electori, et zonto el sia in Germania. Scrive  el conte Cristoforo Frangipani se ritrova de 11, ve-  nuto da la Maestà Cesarea, et uno eleclor, frideìicet  il Palatino, e si aspetava il Maguntino. Scrive ooloqui  attti con monsignor di Chievers, coaMioicandoli le  nove turchesche. Disse sempre il Re saria pronto in  ajutar la cristianità contro questo Turcho, insieme  con li altri principi cristiani, el predpne ajutar la  72* Signoria pur che 1 Re vedesse la Signoria voler es-  ser con questa Maestà, el per far questo bon officio  lui mai non mancherà eie. Scrive esso Ontor, supli-  cando di gratia sia mandato il suceessor, e sopra  questo scrive longamente. Scrive, che slenlerà a  mandar letere perchè non ha chi le porta. Item^  per altre letere, avisa aver dato li pamii di seda li  mandò la Signoria al Gran canzelier, el qual voleva  dar il costo, e V Orator disse la Signorìa li donava, e  lui non volse aceptar se prima non parlava al Re, e  li parlò e fu contento li acetasse. "
101,['Italia'],117,"Di H'antfa^ fo ìetere di V Orator nostro^ da  Pomi^ di 8. Coloqai eoo la illMslrissifna Madama  xeffdia il venir de V Imperador io Italia, et vori ri-  zercbar la Signoria» e Ul parole ut in Utteris. Et  4cbe io Spagna erano gran moli, quelle terre che  leoo quelle novità tra loro, ci scuodeuo le iolmde,  aeuQìuIando danari per ogni caxo li potesse av-  \eiìir eie. "
102,['Italia'],167,"£ con il Pontefice, Soa Maestà disse il Papa sem-  pre Tha servito di bone parole ma non di fati. Ta-  men el tien il Papa sarà con lui volendo venir il  re di Romani con arme in Italia a luor la corona.  L*é ben vero, é sta suspeto per il Papa in quelli  coloqui di reali non si habi tratà alcuna cosa con-  tri esso Pontefice, come etiam lui Orator e U altri  stavano oculati non si Iratasse altro; ma il Papa  e tutti é chiarito non é sta fato alcuna capitulation,  solum strenzersi in amicitia col re de lugaltera et  repudiar ogni acordo con il Catholico.  112 Et con la Signoria nostra acertava era di optima | roentei et penevenr io la boot MMìsa, e( measo che debi promeler m Sernnk^ queste soD coatente opioioii, el ogpi beo di queste SlgMiria reputava SDO el viceversa ; ei disse cbe^ jQltim qodh Maestà amava la Signoria per istinto nataral, elimm feva per ben suo, perché volendo lenir il Stedo di Milan, convien stagi ben con la Signoria. Et li à dillo, bisogna la Signoria e mi iemo il tutto coulra il re di romani, volendo venir con arme, e alender a Verona aziò el non passi, perché son per ajiitarla conrona aziò el non passi, perché son per ajiitarla con tutte le mie forze, et meterli h vita. El cus» ama la illustrissima Bladama questo ExcellenliasiiDO Stalo; ben é vero bisogna andar con Soa Maestà kaloaciite, né darli alcun sospeto, il che faoeodo noo é date, né darli alcun sospeto, il che faoeodo noo é da dubitar se non sempre beo da quella Maestà verso el Stado nostro; e in tempo di turchi, li ba dillo voler meter tutte le so* forze, e venir in persona io ajuto nostro, dicendo V armata lata questo aooo, licet sia sta de gran spexa, ne é sta di grandissiBBa riputation li in Fnnza."
103,['Italia'],168,"Disse, il Re averli ditto : e Orator, io bo 1 Stado  di Milan in Italia; si 1 redi Romani d tolesse, k>ho  tanti regni di qua da monti che mi basta; on si I  volesse el Stado vostro da terra, noo ave altro, part  bisogna che uniti siamo a la conservalioo di quatto ».  Disse averli ditto che certo el voi veoir a Lioo, et  se il Papa li tq;nirà vera a Bologna a parlarli, sì per  ratificar li capitoli feno insieme lì a Boiogoa et alren-  zerli più, come per darsi reputation; e par il Aipa  vadi protraendo, e si 1 vien a lioo, vera t Uiho e  Bologna, poi a veder Mantoa e Ferara, die ba desi*  derio di veder qudle terre e più di vegnir ammno  a veder questa terra ; siche se *1 vien a BoiqgDa certo  el vien de qui. "
104,['Italia'],178,"Fu leio una letera ddVOrator nostro in Fran*  ga, seeretissima, drieata a li Cai di X, di 29. Di  coloqui dil Re con \* Oraior nostro, ei fo mandali li  Secretari fuora, ei sacramenta el Consejo: videiieet^  come il Christiaoissimo re ha dito a TOrator nostro  voi acordarsi la Cesarea Maestà con lui e non venir  in Italia a tuor la corona, con questo voy esser con-  tento che 1 recuperi il Friul, che é di la Signoria  nostra al presente, qual è stato di la caxa di Austria.  E Soa Maestà li ha risposto mai è per abandonar  r amicitia nostra. "
105,['Italia'],255,"Voleoclo cussi le btal dispositioo, quale d mo-  veuo per il voler di lo eCemo Dio, che, inoon ch'io  sia di eli di anni 55, debì conCinuar la mia historia  per forma di diaria, à per voler seguir la promessa  fata al Serenissimo Principe nostro, chedoMenfeel  viveri, se Dio mi darà vita, ne forò nota de ogni oc-  oorentia cii*é sanila non solamente in la citi nostra  et Italia, ma edam per tutto il nnoodo, secondo li  avisi che per jomata se inteoderi ; et essendo stato  questo anno passato per influentia de* deli e sorte  estiva mia fuora dil Senato, non però ho mancato di  scriver cotidianamente ùgùì successo; et al presente  eri ne l'exodentissimo Maior Conscio rimasi di la  Zoola ordinaria, per gratia di quelli che volse fusse  asumpto nel numero di senatori, ai qual et a la patria  mia ho eternamente et imortal ubiigatione; però con  più facilita potrò m^io intender et scriver le occo-  rentie che per jomata achaderano, servando il mio  pristino iostituta E sari il vigesimo odavo libro  prindpiato, prendo lo immenso Iddio lo possi com-  pir con ben et honor di questa excelentissima e cri-  stianissima Repubiicha, et andar seguendo per molti  anni T opera con vita dil SerenissinH) Prindpe no-  stro et eterna mia memoria a la posterità.    A dì primo aduneka dU mese di OciubriOy  introno in Col^o U Capi di XL nuovi : sier Alvise  da cha' da Pfexaro qu. sier Fantin, stato xà molti  anni, et sier Zacaria Boodimier qu. sier Girolamo, et  sier Alvise Basadooa qu. sier Alvise; et Cai dil Con-  sto di X, sier Alvise Malipiero, sier Zorzi Pixani  dotor et cavalier et sier Domenego Contarioi, tutti  tre stati altre Gale. Savi dii Cousejo, sier Antonio  Grimani procuralor, sier Piero Capelo et sier An-  drea Trivixan el cavalier; restano sier Zorzi Corner  d cavaUer procurator, sier Francesco Bragadin, et  sier Luca Trun licei sia rimaso consier. Intrò savio  a Terra ferma sier Marco Foscari, Taltro eleto sier  Piero Contarini é andato fuora per 8 zomi con li-  ceotia dil Prindpe, resta sier Valerio Marzelo, sier  Franeesco Morexini et sier Tomi Mocenigo. Introno  tre Savii ai ordeni, sier Mann Justinian, stato altre  16S * fiale, sier Marco Antonio Corner et sier Lorenzo Bembo nuovi. Sier Zmi PlmieeKO Moeenìgo noe inlroe per cser morta k Badre di io piibe questa note, et sier Vieemo Diedo noo poi proTar lasta note, et sier Vieemo Diedo noo poi proTar la etade."
106,['Italia'],268,"Fu posto, per sier Hironimo da cha' da Pexaro el consier et sier Alvise di Prioli provedadon sora TArsenal : atento TArsenal vechio e novo é aterato e mal si poi trazer galie fuora, per tanto sia preso che li Provedadon sopra le aque debano mandar a far cavar ditto Arsenal, ut in parte. Fu presa. Ave 1 13 di si, 33 di no. 1 70 Fo leto una letera di Alvixe Mariti secretorio nostro a Milan, di 19. Come bavia parlato con domino Brando Porro, leze philosofia a Pavia, di venir a lezer Tordinaria di pbilo6o6a a PaJoa; qual voinir a lezer Tordinaria di pbilo6o6a a PaJoa; qual voi di salario Conni 300 a Tanno, a la fin ha contenta 000 350, né voi mancho. , Fo lato «Ma Mmi £ «MT JlfarHi 2^#i el é0-  tor, podestà, e sier Ahriss Ckmtarim w ji ft i w g  di Fàioa. Come n provedi a qod Studio, pevche  a Pordinaria di philosofia, heaaeDdo bhmIo dooMo  Antonio di Prisciani, reste sohun i Bi g aliao e lo-  gliasi amore Dei o il Spagnol o il ìbaAasm^ e ai  conducili un valente homo. Item^ maocfaa te tedon  di Tordiiiaria in medicina, e si oooduchi qualche va-  lente homo, si ben si dovesse dar ducati lOOQ, e  cassar qualclie leclura superflua, e sarà gran profilo  al Studio e a le cosse di la Scoria nostra per li  scolari lo seguirano. Et hanno mandato uno frate fino  a Perosa per veder di aver el Friso, qual é il primo  homo de Italia, e sì tien vera per mancbarli il favor  di Zuan Paulo Bajon, e suo fiol Malateste esser di  qui etc. "
107,['Italia'],273,"Noto. In le letere di G dil dito Orator, é una pa-  rola notada che 'I Gran canzelier li ha dito come lui  ama Italia, e voria ogni ben, et che la Signoria si poi  dir non è aliata con Pranza ma iotrinsichata, comu-  nichandoli cussi il tutto. "
108,['Italia'],276,"et eavalier, orator no$h% dateaSamlh^a di  6 Septembre. Come a di 3 ha rieefole ooaire di 6,  con rii^aliar il reverendissimo OmlÌDal di boa  oficio fece in le visite de* reaK eie.; et di lapedi podi  a camino, a doman soa signoria zonzera de D dii  parlerà. É venuto de lì uno orator dil Re, va i»  Pranza per dissuader al Re l'andata di quella Maestà  in Italia per abbocarsi con il Papa a Botogna, d "
